John Michael Patrick Daley, , , , , 
John Miner Carey Marble, , , , , 
John Nnaemeka Chika Okonkwo, , , , , 
John Oli Alvin Pinkney, , , , , 
John P. Breckinridge Kadaba, , , , , 
John Patrick N. Torres, , John, Patrick N., Torres, 
John Patrick Poxon Poxon Jr, , , , , 
John Paul Cate Velasco, , , , , 
John Paul Dinolong Visaya, , , , , 
John Peter L Hagan, , John, Peter L, Hagan, 
John R. Young Lindley, , , , , 
John Randall Guido Memeo, , , , , 
John Raymond Enriquez Andres, , , , , 
John Reinhold Paul Ronge, , , , , 
John Richard T. Sychiuco, , John, Richard T., Sychiuco, 
John Ryan Charles Burt, , , , , 
John Stephen Paul Donovan, , , , , 
John Terrence A Rosenthal, , John, Terrence A, Rosenthal, 
John Timothy Weil Harrington, , , , , 
John Townsend Steppe Morris, , , , , 
John William C Richardson, , John, William C, Richardson, 
John Winchel Spencer Butler, , , , , 
John Wisner Wisner Golden, , , , , 
Joi Collete Huckaby Rideout, , , , , 
Jon Andre Goitia Clemens, , , , , 
Jon Paul Ishwarlal Avent, , , , , 
Jon Richard Cleg Parker Jr., , , , , 
Jon Ryan Casey McCratic, , , , , 
Jonathan Bernardine Sevilla Rebong, , , , , 
Jonathan Bruce Simon Nimer, , , , , 
Jonathan David Kalman Sassover, , , , , 
Jonathan Gerard Andre Monette, , , , , 
Jonathan Hudson Paul Foley, , , , , 
Jonathan Iain Max Detrixhe, , , , , 
Jonathan Jacob Lebsack Coleman, , , , , 
Jonathan Lindley Hiatt Blaine, , , , , 
Jonathan Miles Collin Rosenoer, , , , , 
Jonathan Stephan Moacanin Francis, , , , , 
Jonmi Nai On Koo, , , , , 
Joo Hyung Jessica Anderson, , , , , 
Jordan Edward Allen Ferguson, , , , , 
Jordan Neil S. Pugeda, , Jordan, Neil S., Pugeda, 
Jordan Richea Clark Kearney, , , , , 
Jordan Tonya Louise Peters, , , , , 
Jorge Eduardo P. PortugalLeon, , Jorge, Eduardo P., PortugalLeon, 
Jorge Ledezma Flores, , Jorge, Ledezma, Flores, 
Jorge Ralph Capellan Barreno, , , , , 
Jorgen LaCour Soborg Nielsen, , , , , 
Jose Alejos Reyes Borrego, , , , , 
Jose Antonio Ybanez Aboitiz, , , , , 
Jose Daniel Mendonca Parames, , , , , 
Jose Ernesto Alfonso Ocampo, , , , , 
Jose Isaia Ybanez Utzurrum, , , , , 
Jose Maria Dominado Patino, , , , , 
Jose Maria Durazo Merino, , , , , 
Jose Mario Elino Tiu Tan, , , , , 
Jose Miguel Gerodias Suarez, , , , , 
Jose Pericles S Umali, , Jose, Pericles S, Umali, 
Jose Pomposo Barajas, , Jose, Pomposo, Barajas, 
Jose Silvestre Palacios Mafnas Jr, , , , , 
Jose Victor Los Banos Giongco, , , , , 
Josefina Maria Isabel Sanz, , , , , 
Joseph Andrew Mcninch Pazzano, , , , , 
Joseph Edward A. Connell Jr, , Joseph, Edward A., Connell, Jr
Joseph Felix C. Desiderio, , Joseph, Felix C., Desiderio, 
Joseph Francis Stephen Pisano, , , , , 
Joseph Francis Xavier Brennan, , , , , 
Joseph Henry Agyeman Mensah, , , , , 
Joseph Ho Jin Kang, , , , , 
Joseph Jean Pierre Collement, , , , , 
Joseph Jerry Michael Orabona, , , , , 
Joseph John Ignatius David Gopez, , , , , 
Joseph John Michael Lombino, , , , , 
Joseph L. Brent Bodfish, , , , , 
Joseph Lawrence John Appel, , , , , 
Joseph M Patrick Hoppe, , , , , 
Joseph Michael Yates Heilman, , , , , 
Joseph Paul Gauci Maltaman, , , , , 
Joseph Paul Michael Angelo, , , , , 
Joseph Philip Donald Kern, , , , , 
Joseph Ray Atienza Cruz, , , , , 
Joseph Robert James Hurley, , , , , 
Joseph Roger Rick Tache, , , , , 
Joseph Wheeler Dores Bingaman, , , , , 
Joseph Windel Macale Sulit, , , , , 
Josephine Alison Neff Taubert, , , , , 
Josephine Eun Ju Hwang, , , , , 
Josephine Mae Blancaflor Pelaez, , , , , 
Josephine Rachelle Dilao Aranda, , , , , 
Josephine T Torres Parry, , , , , 
Joshua Aaron Ora Strathman, , , , , 
Joshua Alan Chester Mack, , , , , 
Joshua Andrew Samuel Rubin, , , , , 
Joshua Dane Scadron Wattles, , , , , 
Joshua David Helderman Lawler, , , , , 
Joshua David Nelson Hess, , , , , 
Joshua Edward French Real, , , , , 
Joshua Jack Kenneth Anderson, , , , , 
Joshua James Kim Henderson, , , , , 
Joshua Kenneth Salvatore Cali, , , , , 
Joshua Mark Lawless Nelson, , , , , 
Joshua Marren Okabe Mates, , , , , 
Joshua Su Hua Chao, , , , , 
Joshua Wolfe Rambam Pickus, , , , , 
Josi Raye Kennon Swonetz, , , , , 
Josie Anh Thu Nguyen, , , , , 
Josune Aguirre Gamez, , Josune, Aguirre, Gamez, 
Jourdan Michael Mirafuentes Landon, , , , , 
Joy Antonette Bobadilla Diaz, , , , , 
Joy Carmel Rodriguez Abaquin, , , , , 
Joy Edna Margaret Dickerson, , , , , 
Joy Inger Mariko Yamato, , , , , 
Joy Lynn Bala Nemirow, , , , , 
Joy Melina Diaz Llaguno, , , , , 
Joy Wren Kraft Miles, , , , , 
Joyce Elaine Allegro Allegro, , , , , 
Joyce Ellen Manulis Reikes, , , , , 
Joyce Lo Tan Chang, , , , , 
Joyce Michiye Ichiyasu Okinaka, , , , , 
Juan Antonio Abad Sedillo, , , , , 
Juan Carlos Gonzalez Bonilla, , , , , 
Juan Carlos Hernandez Jauregui, , , , , 
Juan Pablo G. Zaragoza, , Juan, Pablo G., Zaragoza, 
Jude Thaddeus Augustus Powers, , , , , 
Judith Alexis Brigham Bowie, , , , , 
Judith Ann Goss Newton, , , , , 
Judith Ann Kuperberg Bock, , , , , 
Judith Aurora Yosepha Fiorentini, , , , , 
Judith Benzaquen Parkes, , Judith, Benzaquen, Parkes, 
Judith Frances Ritch Hayes, , , , , 
Judith Gay Armstrong Flavin, , , , , 
Judith Helen Berliner Cohen, , , , , 
Judith Kimball Taylor Kent, , , , , 
Judith L Fallon Kernel, , , , , 
Judith Lynne Olson Lasker, , , , , 
Judith Marian Imelda Garvey, , , , , 
Judith Martha Darrow Johnson, , , , , 
Judith Seuk Han Hom, , , , , 
Judith Sylvia Belderol Lewis, , , , , 
Judy A. Lam Fong, , , , , 
Judy Chia Chi Shih, , , , , 
Judy Hyun An Vulchev, , , , , 
Judy Man Ni Mok, , , , , 
Judy Melinda Jo Dick, , , , , 
Julia A Bowen Stern, , , , , 
Julia Ann Martin Bjerknes, , , , , 
Julia Annes Stedile, , Julia, Annes, Stedile, 
Julia Carol Hambleton Perkins, , , , , 
Julia Carolyn Lucia Souza, , , , , 
Julia Christine Ma Powers, , , , , 
Julia Claire Hampson Sibley, , , , , 
Julia Esther Campos Vera, , , , , 
Julia Jane R Lewald, , Julia, Jane R, Lewald, 
Julia Lane Cochrane Soderbery, , , , , 
Julia Lawrence Pool Wald, , , , , 
Julia Mary Combs Friedlander, , , , , 
Julia Peixoto de A Arruda, , , , , 
Julia Reed Zaic, , Julia, Reed, Zaic, 
Julia Ruth Rudser Gonzales, , , , , 
Julia Shawn Lin Yee, , , , , 
Julia Sun Young Yim, , , , , 
Julia Ten Eyck, , Julia, , Ten Eyck, 
Julian Chen Lien Chang, , , , , 
Julian David Palacio Aris, , , , , 
Julian Pardo de Zela, , Julian, Pardo, De Zela, 
Julian Sanchez Mora, , Julian, Sanchez, Mora, 
Julian Thomas Herbert Kleindorfer, , , , , 
Juliana Garcia-Gombau Romeu, , Juliana, Garcia-Gombau, Romeu, 
Julie Ann Koons Jarvi, , , , , 
Julie Ann Payne Humphreys, , , , , 
Julie Ann Stern Jacobs, , , , , 
Julie Ann Terrado Talbo, , , , , 
Julie Ann Turoci Philippi, , , , , 
Julie Ann Wycoff Rogers, , , , , 
Julie Anna McCabe Tripp, , , , , 
Julie Christina Goulet Stromberg, , , , , 
Julie Christine Brooks Mains, , , , , 
Julie Christine Rodriguez Aldort, , , , , 
Julie Chu Hui Kang, , , , , 
Julie Danielle Ledford Huss, , , , , 
Julie Del V Catancio, , , , , 
Julie Diane Robbins Vivas, , , , , 
Julie Gutman Dickinson, , Julie, Gutman, Dickinson, 
Julie K. Andro VanNostern, , , , , 
Julie Katherine Leskinen Mecklenburg, , , , , 
Julie Marie Ferrio Warren, , , , , 
Julie Marie K. Cepeda, , Julie, Marie K., Cepeda, 
Julie Marie O'Connor Sinclair, , , , , 
Julie Michelle Crowe Soper, , , , , 
Julie Rivers Howard Drenner, , , , , 
Juliet Jenny Schey Meinert, , , , , 
Juliet Kim Nguyen Mushet, , , , , 
Juliet Marian Karegyesa Byabagye, , , , , 
Juliet Polk Howland Kane, , , , , 
Juliette Elizabeth Lewis Dobson, , , , , 
Juliette Louise Florence Peignier, , , , , 
June Park Kwon Liu, , , , , 
Junn Oga Raemarc Paulino, , , , , 
Justin Christian Cardenas Rono, , , , , 
Justin Eric David Daily, , , , , 
Justin Ga Kin Lau, , , , , 
Justin James Scott Morgan, , , , , 
Justin Jeffrey Taylor Hughes, , , , , 
Justin Joel A. Jannone, , Justin, Joel A., Jannone, 
Justin John Ka-Win Chin, , , , , 
Justin Lord Y. Vitug, , Justin, Lord Y., Vitug, 
Justin Peter Daniel Lang, , , , , 
Justin Robert Gilbert McKellar, , , , , 
Justin Sean Raymond Tipp, , , , , 
Justin Seth Fels Wolff, , , , , 
Justin Taylor Maes Curley, , , , , 
Justine Eva L Villanueva, , Justine, Eva L, Villanueva, 
Justine Jung Hee Bae, , , , , 
Jyoti Jay Jennings Roth, , , , , 
K Poncho Lee Baker, , , , , 
Kacie Andrin Rae Barrier, , , , , 
Kacie Marie Jones Owen, , , , , 
Kaeleen Emiko Ng Korenaga, , , , , 
Kaitlin M Mcdaniel Talley, , , , , 
Kaitlin Naomi Komure Toyama, , , , , 
Kaitlyn Amanda Noelani Gosewehr, , , , , 
Kaitlynne Marie Lorraine Tracey, , , , , 
Kang Won Mathew Choi, , , , , 
Kara Anne D'Alessand Bielli, , , , , 
Kara Elizabeth Farmer Chizever, , , , , 
Kara Gabrielle Victoria Martin, , , , , 
Kara Ka Wah Chien, , , , , 
Kara Koerner Marc, , Kara, Koerner, Marc, 
Kara Leah Noseworthy Naish, , , , , 
Karen Ann Christiansen Doherty, , , , , 
Karen Ann Marie Soell, , , , , 
Karen Ann Miller Funk, , , , , 
Karen Anne Keeton Howard, , , , , 
Karen Anne Renfree Clark, , , , , 
Karen Danielle Morse Denvir, , , , , 
Karen Eileen Edmonson Bowen, , , , , 
Karen Elise Ricketts Osborne, , , , , 
Karen Jane Dodson Geiss, , , , , 
Karen Jen Fu Wang, , , , , 
Karen Joie M. Dubert, , Karen, Joie M., Dubert, 
Karen Kum Hi Khim, , , , , 
Karen L. Green Rosin, , , , , 
Karen Lima Bae Neville, , , , , 
Karen Marie Pelaez Robicheau, , , , , 
Karen Michelle Beza Hawkes, , , , , 
Karen N Ikeda Ballack, , , , , 
Karen Renee Alston Monroe, , , , , 
Karen Sun Young Hwang, , , , , 
Karen Von Esch Dickson, , , , , 
Karen Weems Howden Weaver, , , , , 
Karen Wing Ka Yiu, , , , , 
Karena Munguia Luna, , Karena, Munguia, Luna, 
Kari Dawn Searles Sullivan, , , , , 
Kari Jo Berge Lucas, , , , , 
Kari Lyn Ricci Mueller, , , , , 
Karilyn Rose Bratvold Sowers, , , , , 
Karin Alison Lan Borchard, , , , , 
Karin Ellen Margareta Bjork-Tjornhom, , , , , 
Karin Kiyoko Itatani Oyadomari, , , , , 
Karin Marie Smith Brink, , , , , 
Karin Nicole Stitt Sokol, , , , , 
Karina Anna Pergament Houghton, , , , , 
Karina Grace P Oribello-Estillore, , Karina, Grace P, Oribello-Estillore, 
Karina Roxana Velasquez Santa Cruz, , , , , 
Karissa Marie Hurst Freano, , , , , 
Karl Jung Hwan Suh, , , , , 
Karla Jean Damatac Bacayan, , , , , 
Karla Jeanne Strotz Pinckes, , , , , 
Karlyn Hahn Bell Kurichety, , , , , 
Karol E. Parrish Boloorchi, , , , , 
Karol L. Kincaid Pollock, , , , , 
Karyn Alycia McCreary Jakubowski, , , , , 
Karyn Elise Barnes Bell, , , , , 
Karyn Jennifer Anne Taylor, , , , , 
Karyn Nicole Miller Chandler, , , , , 
Kasey Marie Viola Podzius, , , , , 
Kassandra Aolani Arroyo Perez, , , , , 
Katarzyna Monika Grzechnik Neill, , , , , 
Kathaleen Elaine C Miller, , Kathaleen, Elaine C, Miller, 
Katharine Ann Post Klein, , , , , 
Katharine Brittney Kiyomi Lau, , , , , 
Katharine Helen S. MacKenzie, , Katharine, Helen S., MacKenzie, 
Kathe Inge Irmgard Thayer, , , , , 
Katherine Amelia Miller Zessin, , , , , 
Katherine Ann Bedard Kraus, , , , , 
Katherine Ann Fekula Gotcher, , , , , 
Katherine Anne Fosseen Wenger, , , , , 
Katherine Anne Sullivan Morgan, , , , , 
Katherine Brandon Fait Buxton, , , , , 
Katherine Clare Hill Bissett, , , , , 
Katherine Diane Hart Hasper, , , , , 
Katherine Fallon L DeGovia, , Katherine, Fallon L, DeGovia, 
Katherine Hyang Wol Dick, , , , , 
Katherine Janey Gomez McKeon, , , , , 
Katherine Jungyun Sohn Kang, , , , , 
Katherine Karyun Cheng Arnold, , , , , 
Katherine Lucy Kelley Reynolds, , , , , 
Katherine Marie Niznik Roselin, , , , , 
Katherine Mary Ann Loo, , , , , 
Katherine Mary Conard Manuel, , , , , 
Katherine Michelle Massey Zimmerl, , , , , 
Katherine Nicole Smith Denson, , , , , 
Katherine Rose Schloss Ackerman, , , , , 
Katherine Theresa Hause Becker, , , , , 
Katherine Theresa Kennelly Olds, , , , , 
Kathleen A. VonUnruh Dashiell, , , , , 
Kathleen Alane M. Consolatti, , Kathleen, Alane M., Consolatti, 
Kathleen Ann Eagan Murray, , , , , 
Kathleen Ann Espiritu Natividad, , , , , 
Kathleen Ann Murphy Jones, , , , , 
Kathleen Anne Knotts Hernandez, , , , , 
Kathleen Elisabeth Shults Manolakas, , , , , 
Kathleen Elizabeth Barnett Scherger, , , , , 
Kathleen Elizabeth Ingram Wise, , , , , 
Kathleen Jo Clement Carter, , , , , 
Kathleen L. Tubania Bailey, , , , , 
Kathleen Lillian Brennan de Jesus, , , , , 
Kathleen M OConnell Polanowicz, , , , , 
Kathleen M. Nishitomi Horan, , , , , 
Kathleen Marie B. Cumberbatch, , Kathleen, Marie B., Cumberbatch, 
Kathleen Marie Hadsell Bray, , , , , 
Kathleen Marie Klein Brahn, , , , , 
Kathleen Mary Kushi Carter, , , , , 
Kathleen Nanette Lucas Nemeth, , , , , 
Kathleen Natalina Mastagni Storm, , , , , 
Kathleen Robin Ann Lewison, , , , , 
Kathleen Sasha Scott Kelso, , , , , 
Kathleen St Johns Sloan, , , , , 
Kathleen Veronica Ferchland Boriolo, , , , , 
Kathryn Ann Barry Bartow, , , , , 
Kathryn Anne Volper Crivello, , , , , 
Kathryn Beth Quarles Gray, , , , , 
Kathryn Diane Zajec Domin, , , , , 
Kathryn Dorland Morton Morton, , , , , 
Kathryn E. Kolts Showers, , , , , 
Kathryn Eileen Martin McHenry, , , , , 
Kathryn Elizabeth Lupul Burton, , , , , 
Kathryn Elizabeth Swisher Henderson, , , , , 
Kathryn Jane Monson Latour, , , , , 
Kathryn Johnson Finn, , Kathryn, Johnson, Finn, 
Kathryn Lee Ekstrom McCarty, , , , , 
Kathryn M Aguirre Worth, , , , , 
Kathryn Marie Magsaysay Herrera, , , , , 
Kathryn Mary McCann Newhall, , , , , 
Kathryn Nalani Setsuko Hong, , , , , 
Kathryn Sayr Falk Campbell, , , , , 
Kathryn Susannah Heyer Cosgrove, , , , , 
Kathryn Tamura Kawaichi Schultz, , , , , 
Kathryn Therese Muldoon Griffin, , , , , 
Kathy Huiwen Dong Tsai, , , , , 
Kathy Trang Uyen Luong, , , , , 
Katia Maud Maria Verresen, , , , , 
Katie Colleen McCurdy Brach, , , , , 
Katie Jeannine Lewis Scott, , , , , 
Katie Jo Marie Waddell, , , , , 
Katrin Martha R Kohncke, , Katrin, Martha R, Kohncke, 
Katrina Mae Castillo Espina, , , , , 
Katrina Marysse Gonzales Nelson, , , , , 
Katryn Hope Echiverri Ranoa, , , , , 
Katy Lynn McCully Merrill, , , , , 
Katy Pearl Kendig Walker, , , , , 
Kay Del Carmen Holley, , , , , 
Kaye E. Brogger Hambleton, , , , , 
Kayla Elizabeth Moses Berlin, , , , , 
Kayla Sue Siam Betbout, , , , , 
Kaytie Thy Phuong Dinh, , , , , 
Kealiionalani Don Paul Brede, , , , , 
Kearny Eiu Youn Chang, , , , , 
Kee Ana Patricia Smith, , , , , 
Keever Anya Rhodes Muir, , , , , 
Keira Maisie Sophie Ferrari, , , , , 
Keith Craig Mark Valory, , , , , 
Keith Rhoderic Dhu Hamilton II, , , , , 
Keith Sam Kong Ching, , , , , 
Kellen Brian Howard Sinclair, , , , , 
Kelley Kathleen Stimpel Martinez, , , , , 
Kelley Marie Blasa Fox, , , , , 
Kelley Suzanne Elkins Kern, , , , , 
Kellie Ann Rasmusson DiDia, , , , , 
Kellie Michele Taylor Chrisman, , , , , 
Kelly Ann Mai Khanh Tran, , , , , 
Kelly Anne Murphy Berlingeri, , , , , 
Kelly DeGraw McCaffrey Combs, , , , , 
Kelly Edythe Louise Miller, , , , , 
Kelly Elizabeth Sutter Dankbar, , , , , 
Kelly Hwei Yee Kang, , , , , 
Kelly Jean Curry Ortiz, , , , , 
Kelly Joe Shindell DeLacey, , , , , 
Kelly Kathlyn Andres Reynolds, , , , , 
Kelly Lynn Charhut Hughes, , , , , 
Kelly Lynn Katherine Babineau, , , , , 
Kelly M Auerbach Hassel, , , , , 
Kelly Marie Mejia Meehleib, , , , , 
Kelly Mary OBryan Bell, , , , , 
Kelly Renee Boatman Roberson, , , , , 
Kelly Renee Finley Nebiolini, , , , , 
Kelly Xi Huei Lalith Ranasinghe, , , , , 
Kellyjean Mei Lan Chun, , , , , 
Kelsey Anne Willits Raymond, , , , , 
Kelsey Leigh Anne Maxwell, , , , , 
Kelvin Tse Kei Chew, , , , , 
Kendall Kelly Alexis Turner, , , , , 
Kendall Lynn Darr Bonebrake, , , , , 
Kendra LaVon Powell Humphreys, , , , , 
Kendra Lea Rupe Atkinson, , , , , 
Kendra Meilin Simon Perdue, , , , , 
Kenneth Henry John Henjum, , , , , 
Kenneth Holger Eklund Nordin, , , , , 
Kenneth Hung Quon Dang, , , , , 
Kenneth Ka Wai Pang, , , , , 
Kenneth Kahan Ward Newton, , , , , 
Kenneth Kheim Duc Vu, , , , , 
Kenneth Lee Francis Stupak, , , , , 
Kenneth Myrnan Henry Hoff, , , , , 
Kenneth Peng Kiat Chia, , , , , 
Kenneth Suey Kee Yee, , , , , 
Kenny Khoa Vu Nguyen, , , , , 
Keri Colleen Patrice Klein, , , , , 
Keri Lynn Aiko Nakawatase, , , , , 
Keri-Ann Kaila Nicole Crawford, , , , , 
Kerne Hung On Matsubara, , , , , 
Kerri Ann Rich Cutforth, , , , , 
Kerrie Ellen Taylor McNally, , , , , 
Kerrin Ning Tsou Liu, , , , , 
Kerry Anne Filerino Green, , , , , 
Kerry Irene McInerney Freeman, , , , , 
Kerry Robin Eskenas Schlossberg, , , , , 
Kerry St. Clair Doyle, , , , , 
Kevin Cheng Han Tsai, , , , , 
Kevin Chin Kai Chou, , , , , 
Kevin Earl John Jarvis, , , , , 
Kevin Francis David Bernie, , , , , 
Kevin Hee Young Jang, , , , , 
Kevin Howard Richard Sherman, , , , , 
Kevin Kar Chun Shek, , , , , 
Kevin Kin Chun Chiu, , , , , 
Kevin Kook Tai Leung, , , , , 
Kevin Le Roi Shaw, , , , , 
Kevin Min Kul Suh, , , , , 
Kevin Patrick Mytruk Garland, , , , , 
Kevin Terrence Edward Dunbar, , , , , 
Kevin Won Suk Chiang, , , , , 
Khalid Abdullah T C Almansour, , Khalid, Abdullah T C, Almansour, 
Khanh Le V. Trinh, , Khanh, Le V., Trinh, 
Khanh Linda Phuong Vu, , , , , 
Khymberli Sika Yawo Apaloo, , , , , 
Kiara Robles Chavez, , Kiara, Robles, Chavez, 
Kier Marie Rose Purdy, , , , , 
Kieran Daniel Cruz Manjarrez, , , , , 
Kiley Ann Barnhorst MacDonald, , , , , 
Kim C. Wollenberg Burgess, , , , , 
Kim Chau Thoai Pham, , , , , 
Kim Ha Do Hara, , , , , 
Kim Loan Thi Dawley, , , , , 
Kim Loreen Campbell Erb, , , , , 
Kim M Garlin Dunning, , , , , 
Kim Michelle Futran Davis, , , , , 
Kim My Thi Bui, , , , , 
Kim Natalie Alicia Boras, , , , , 
Kim Nga N. Nguyen, , Kim, Nga N., Nguyen, 
Kim Rebecca I. Brogan, , Kim, Rebecca I., Brogan, 
Kim Thy Hoang Bayliss, , , , , 
Kimberlee Dee Ann Kingsbury, , , , , 
Kimberley Allison Gertrud Stouffer, , , , , 
Kimberley Carla Johanna Kester, , , , , 
Kimberley Germaine Yen Leng Nobles, , , , , 
Kimberley Hendrika Goei Sakai, , , , , 
Kimberly A Harris Moses, , , , , 
Kimberly Ann Marie Stewart, , , , , 
Kimberly Ann Maynard Carasso, , , , , 
Kimberly Ann Redlinger Daniels, , , , , 
Kimberly Ann Sorisio Hiscox, , , , , 
Kimberly Anne Williams Clare, , , , , 
Kimberly Beth Freeman Malin, , , , , 
Kimberly Brooke Lloyd Todaro, , , , , 
Kimberly Christine Meckfessel Taylor, , , , , 
Kimberly Dawn Lewis Lessing, , , , , 
Kimberly Dawn Stone Dewey, , , , , 
Kimberly Ellen Abkin Brice, , , , , 
Kimberly Erin Marks Solomon, , , , , 
Kimberly Helene Fielding Vinocour, , , , , 
Kimberly Irene Culp Cloyd, , , , , 
Kimberly Jean Morley Paul, , , , , 
Kimberly Jean Toni Doneche, , , , , 
Kimberly Joy Asselin Vu, , , , , 
Kimberly Joyce Hueter Gilworth, , , , , 
Kimberly Leilani Joan Lutes-Koths, , , , , 
Kimberly Lensey Sellers Palsson, , , , , 
Kimberly Lynn Kakavas Garner, , , , , 
Kimberly Moun Jun Lim, , , , , 
Kimberly Rachelle Sault Lynch, , , , , 
Kimberly Reitz Helms Lewis, , , , , 
Kimberly Sue Navarro Barrientos, , , , , 
Kira Leah Murray Klement, , , , , 
Kira Lorin Bond Johnson, , , , , 
Kiran Preet Kaur Dhillon, , , , , 
Kirenjeet Kaur Ubhi Rockenstein, , , , , 
Kirin Brooke Rinehart McKenna, , , , , 
Kirk Scot Whitman Tracey, , , , , 
Kirsten Aimee Roe Worley, , , , , 
Kirstin Lee Ericson Ellis, , , , , 
Kisha Nicole Bryan Cordero, , , , , 
Kitty Anastasia Martin Baker, , , , , 
Kitty Kit Yee Szeto, , , , , 
Kja Kelike Shelene Harper-Gopaul, , , , , 
Koh Siok Tian Wilson, , , , , 
Konrad Karl Wilhelm Larson, , , , , 
Koral Elyse Fusselman Alman, , , , , 
Kornelia Johanna Agatha Davidson, , , , , 
Kris Dena Ward Ferrell, , , , , 
Kris Hue Chau Man Brewer, , , , , 
Krista Anne Celentano Grewal, , , , , 
Krista Anne Marie Contino Saumby, , , , , 
Krista Don Stark Dupps, , , , , 
Krista Leigh Vink Venegas, , , , , 
Kristal Danica Ray Acosta, , , , , 
Kristel Adriane Massey Robinson, , , , , 
Kristen Ann Watts Shelton, , , , , 
Kristen Anne Keerma Friedman, , , , , 
Kristen Candace Lara Myers, , , , , 
Kristen Elizabeth Boyle Montez, , , , , 
Kristen Elyce Brumfield Rajagopal, , , , , 
Kristen L Welles Lanham, , , , , 
Kristen La Tempa Ginsberg, , , , , 
Kristen Marie Jarvis Johnson, , , , , 
Kristen Marie Richmond Blabey, , , , , 
Kristen Michele Ross Sakamoto, , , , , 
Kristen Michelle Buck Bemis, , , , , 
Kristen Nicole Comerford Laggner, , , , , 
Kristen Paulene Lantz Reichenbach, , , , , 
Kristi Kimi Hong Yamano, , , , , 
Kristi L Gudoski Cook, , , , , 
Kristi Leigh Kasey Young, , , , , 
Kristi Lynn Malia Badoyen, , , , , 
Kristiana Brittany Kate Larson, , , , , 
Kristin Anne Cohoon Olin, , , , , 
Kristin Anne Torres Mowat, , , , , 
Kristin Elizabeth Daughters Dunn, , , , , 
Kristin Elizabeth Snow Reynolds, , , , , 
Kristin Kim Sato Fountain, , , , , 
Kristin Laurel Dyck Siemens, , , , , 
Kristin Marie Fowle Smith, , , , , 
Kristin Marie Johnson Zlotnik, , , , , 
Kristin Martha Marie Bengfort, , , , , 
Kristin Maureen Koenig Johns, , , , , 
Kristin Paige Kyle de Bautista, , , , , 
Kristina Ashley Bantigue Ramos, , , , , 
Kristina Bui Carlson, , Kristina, Bui, Carlson, 
Kristina Marcia Hall McMillen, , , , , 
Kristina Marie Hein Gill, , , , , 
Kristina Noel Avena Buan, , , , , 
Kristine Marie Stampen Burck, , , , , 
Kristine Melo Ejercito Mengoli, , , , , 
Kristofer Allen Michael Thompson, , , , , 
Kristoffer James S. Jacob, , Kristoffer, James S., Jacob, 
Krystal N Denley Bowen, , , , , 
Kuscha Hatami Fard, , Kuscha, Hatami, Fard, 
Kwang-yi Ger Gale, , Kwang-Yi, Ger, Gale, 
Kwasi Abraham Adjapong Asiedu, , , , , 
Kyle A Mitchell Virgien, , , , , 
Kyle Andreas Chase Kuersten, , , , , 
Kyle Elizabeth Kelly Matarrese, , , , , 
Kyle Karl Charles Tambornini, , , , , 
Kyle Lee Hallett Hargrave, , , , , 
Kyle Leighton Kichitaro Kurata, , , , , 
Kyle Phillipe Montes De Oca, , , , , 
Kyle Tae Won Oh, , , , , 
Kyoung Joo Sue Oh, , , , , 
Kyra Maura Sanin Lilien, , , , , 
L Samuel Anthony Kassatly, , , , , 
L T Eugene Ness, , , , , 
L. Celeste H. Blumer, , L., Celeste H., Blumer, 
La Tonia Mary Fisher, , , , , 
La Verne Ann Ramsay, , , , , 
Lacey Jae Shim Robb, , , , , 
Lael Lee M Abaya, , Lael, Lee M, Abaya, 
Laila Lorraine Morcos Santana, , , , , 
LaJohnne Alexa White Morris, , , , , 
Lala Tiao Tiao Wu, , , , , 
Lan Pham The Nguyen, , , , , 
Landon Jan Ming Yun, , , , , 
Lanetta Diane Wilkinson Rinehart, , , , , 
Lani Anne Iyo Kimura, , , , , 
Lani M. Sen Woltmann, , , , , 
Laquae Raeshawn Kadesha Felix, , , , , 
Lara Alise Villarreal Hutner, , , , , 
Lara Allyn Sophia Callas, , , , , 
Lara Ani Hourie Shortz, , , , , 
Lara Anne Oravec Bradt, , , , , 
Lara Catherine Recknagel Gruber, , , , , 
Laraine Mary Isabella Burrell, , , , , 
Larisa Rasma Lacis Brosko, , , , , 
Larissa AmberJane Kehoe Hoffman, , , , , 
Larkie Diem Linh Dam, , , , , 
Larry Allen Tirador Valdez, , , , , 
Larry Jen Ho Liu, , , , , 
Larry La Rue Zenker, , , , , 
Larry Lawrence Joseph Thorp, , , , , 
Lars Erik Dion Kindem, , , , , 
Latrice Antoinette George Byrdsong, , , , , 
Launa Nicole Everman Adolph, , , , , 
Laura Ann Stitt Sheedy, , , , , 
Laura Ann Tall Liu, , , , , 
Laura Anne Guggenheim Chapman, , , , , 
Laura Carroll Karlak Ostrem, , , , , 
Laura E Underwood Muschamp, , , , , 
Laura E. Hammond Farrow, , , , , 
Laura Elaine Parker Kelly St. Martin, , , , , 
Laura Elizabeth Hinojosa Quinonez, , , , , 
Laura Elizabeth Lucas Palekar, , , , , 
Laura Ellen Wunsch Stubberud, , , , , 
Laura J Fischer Noll, , , , , 
Laura Jane Neumeister Wright, , , , , 
Laura Jean Riley Dougherty, , , , , 
Laura Jeanne Monique Roman, , , , , 
Laura Kathryn Weimer Delucchi, , , , , 
Laura Lee Josephine Briggs, , , , , 
Laura Lee M Norris, , Laura, Lee M, Norris, 
Laura Lee Shaw Howe, , , , , 
Laura Louise Newman Taylor, , , , , 
Laura Marie Hanney Torres, , , , , 
Laura Mary Nash Furniss, , , , , 
Laura Michelle Hamister Zwilling, , , , , 
Laura Nicolle Patterson Marchan, , , , , 
Laura Padilla Berger, , Laura, Padilla, Berger, 
Laura Penney Albright Boat, , , , , 
Laura Stella Fedelina Lucero, , , , , 
Laura Van Buren Gerrity, , , , , 
Laura Victoria Kline Bartels, , , , , 
Laurel Ellis Parker Simmons, , , , , 
Laurel Gilbert G Phillips, , Laurel, Gilbert G, Phillips, 
Laurel Jean Werner Vogt, , , , , 
Lauren Anne Dellinger Schmidt, , , , , 
Lauren Ashley Sanvictores Aros, , , , , 
Lauren Brooks Sabb Veggian, , , , , 
Lauren Derstine Humphrey, , Lauren, Derstine, Humphrey, 
Lauren Elise Foster Wu, , , , , 
Lauren Elizabeth Cleland Birkenstock, , , , , 
Lauren Elizabeth Frawley Misajon, , , , , 
Lauren Elizabeth Sylvia Horwitz, , , , , 
Lauren Elle Christina Pon, , , , , 
Lauren Hide Ming Gee, , , , , 
Lauren Jutta Moniz Zalona, , , , , 
Lauren Lucinda Loyd Wilson, , , , , 
Lauren Mae Daniels Fischer, , , , , 
Lauren Mary Dominique Whitted, , , , , 
Lauren Michelle Killeen Parker, , , , , 
Lauren Ngoc Lan Vuong, , , , , 
Lauren Quynh Anh Guerdat, , , , , 
Lauren Suzanne Macheski Loyd, , , , , 
Lauren Taylor Amato Strackbine, , , , , 
Lauren Young Epstein, , Lauren, Young, Epstein, 
Laurence Forsyth Brown Andrews, , , , , 
Laurette Michelle Garcia Giacomo, , , , , 
Laurie Ann Wong Hodges, , , , , 
Laurie Anne Messerly Stewart, , , , , 
Laurie Emerson Barber, , Laurie, Emerson, Barber, 
Laurie Moon Jung Jun, , , , , 
Laurie Rose Labaria Lubiano, , , , , 
Laurie Sue Melhado Richardson, , , , , 
Laurie-Ann Mei Inn Look, , , , , 
Lauro Louis Padua Bautista, , , , , 
Lawnlia V Amethyst Grant, , , , , 
Lawrence Bruce William Taylor, , , , , 
Lawrence Buong Ling Lau, , , , , 
Lawrence Francis Xavier McGrail, , , , , 
Lawrence Julius M Turman, , Lawrence, Julius M, Turman, 
Lea Ghita Marguerite Bendahou, , , , , 
Lea Marie Baello Bagtas, , , , , 
Lea Patricia Lobo Francisco, , , , , 
Leah A. Plaskin Lorenz, , , , , 
Leah Collier Fletcher Wilson, , , , , 
Leah Elizabeth Abeles Solomon, , , , , 
Leah Sabrina Abad Zarin, , , , , 
Leah Sarel Schneider Bergman, , , , , 
Leah Stacy Fay Samuels, , , , , 
Leah Tuffanelli Blofeld, , Leah, Tuffanelli, Blofeld, 
Leanna Joy Albrecht Beaber, , , , , 
LeAnna Maria Gutierrez Cumber, , , , , 
Leanna Maria Rose Dawydiak, , , , , 
Leanne Jean Fisher Rodgers, , , , , 
