Michael Eric Hunter Anderson, , , , , 
Michael George Hernan Anderson, , , , , 
Michael Gihei Adura Miranda, , , , , 
Michael Henry Maurice Todaro, , , , , 
Michael Hin Cho Chun, , , , , 
Michael J. Mac McGinnis, , , , , 
Michael James C. McCrossen, , Michael, James C., McCrossen, 
Michael James Lawrence White, , , , , 
Michael Jens Frederick Smith, , , , , 
Michael John Espana Reilly, , , , , 
Michael John Lee Quesnel, , , , , 
Michael John Martinez Areinoff, , , , , 
Michael John Middleton Brook, , , , , 
Michael John Patrick Sweeney, , , , , 
Michael John Weills Siegel, , , , , 
Michael Jonathan A Karlin, , Michael, Jonathan A, Karlin, 
Michael Joon O Shin, , Michael, Joon O, Shin, 
Michael Josef Wagner Conlan, , , , , 
Michael Joseph Gonzales Lagrama, , , , , 
Michael Joseph Tsvi Wilson, , , , , 
Michael Joshua J. R. Valdez, , Michael, Joshua J. R., Valdez, 
Michael King Thomas Tan, , , , , 
Michael Laurence Harold Meyer, , , , , 
Michael Le Boutillier Jensen, , , , , 
Michael Lee Stanford Hawkins, , , , , 
Michael Leland Feliz Buck, , , , , 
Michael Leong Bong Yee, , , , , 
Michael Mark Anthony Daly, , , , , 
Michael Mitchell F Angello, , Michael, Mitchell F, Angello, 
Michael Mon You Chang, , , , , 
Michael Monroe Kellogg Sebree, , , , , 
Michael Peter Olel Okayo, , , , , 
Michael Ray Edward Sanders, , , , , 
Michael Ray Edward Sanders, , , , , 
Michael Royce Darr LaRue, , , , , 
Michael Shin Yuan Yu, , , , , 
Michael Silva Hughes Fortes, , , , , 
Michael Sun Fung Yu, , , , , 
Michael Tai Chi Yang, , , , , 
Michael The Truong Nguyen, , , , , 
Michael Thomas Tinan Carlson, , , , , 
Michael Thomas- Creighton Falotico, , , , , 
Michael Tiong Tsnia Chuah, , , , , 
Michael Todd George Coker, , , , , 
Michael Van Manen Pinkel, , , , , 
Michael William Edward Coke, , , , , 
Michael William Goodrich Visconti, , , , , 
Michael William Manasse Manoukian, , , , , 
Michael William Richard Deibert, , , , , 
Michael William Stuart Bristow, , , , , 
Michael Yoo Lim Jung, , , , , 
Michael You Ming Toy, , , , , 
Michaelin Daria Kiperchuk Scott, , , , , 
Michel Ramzy Abied Shenouda, , , , , 
Michele Anne Crisafi Mathis, , , , , 
Michele Cathy Ann Lillie, , , , , 
Michele Christine Forrar Atkins, , , , , 
Michele Del Rosso Murphy, , , , , 
Michele Fay Leichtman Weiss, , , , , 
Michele I Zayas Cheney, , , , , 
Michele Mary Frances Marsh, , , , , 
Michele Sara Cobin Friedlander, , , , , 
Michele Yvette F Sarko, , Michele, Yvette F, Sarko, 
Micheline Noel Nadeau Fairbank, , , , , 
Michelle Ann Buchmeier Acosta, , , , , 
Michelle Ann Richardson Johnson, , , , , 
Michelle Beth Oyler Saifer, , , , , 
Michelle Chai Ping Koh, , , , , 
Michelle Christine Haddad Zehner, , , , , 
Michelle Der Ohanesian, , Michelle, , Der Ohanesian, 
Michelle Diana Samani Rabin, , , , , 
Michelle Dyan Phillips Carrino, , , , , 
Michelle Elizabeth Pusateri Vasquez, , , , , 
Michelle Elizabeth Wells Trigger, , , , , 
Michelle Felicia Rita Richie, , , , , 
Michelle Gar Wai Cheung, , , , , 
Michelle Ho Deardorff Edge, , , , , 
Michelle Joy Rosen Rosenblatt, , , , , 
Michelle Juliette Laksman Dordick, , , , , 
Michelle Jung Min Choi, , , , , 
Michelle Kay Wright Knoop, , , , , 
Michelle Kelli LeRoux Burton, , , , , 
Michelle L Finneran Dennedy, , , , , 
Michelle Le Uyen Tran, , , , , 
Michelle Leila Cecilia Carpenter, , , , , 
Michelle Lyne Gomez Hertzog, , , , , 
Michelle Lynn Schuller Lewis, , , , , 
Michelle Margaret Clark Altick, , , , , 
Michelle Marie Brown DeMaio, , , , , 
Michelle Quynh Anh Nguyen, , , , , 
Michelle Robinson Avila, , Michelle, Robinson, Avila, 
Michelle Sandra Marie Leight, , , , , 
Michelle Sheri Lynn Michaels, , , , , 
Michelle Yin Yu Miu, , , , , 
Mieke Ter Poorten, , Mieke, , Ter Poorten, 
Miguel Lloyd Cruz Undayag, , , , , 
Miguel O Martinez Barquera, , , , , 
Mika Yamagata Muramoto Iden, , , , , 
Mikaela Grace Monson Cox, , , , , 
Mikayla Rose Eve Pentecost, , , , , 
Mikki Catherine Bako Sorensen, , , , , 
Mildred Faye Welsh Hostein, , , , , 
Miller Kimball Fount Hinds, , , , , 
Milo Manopoulos Beitman, , Milo, Manopoulos, Beitman, 
Mimi Marie Violet Glumac, , , , , 
Mina Refat Louis Said, , , , , 
Minh Hang Thi Hoang, , , , , 
Minh Hieu Thi Luong, , , , , 
Minh Quang Steven Dovan, , , , , 
Minna Lo Shihuah Naranjo, , , , , 
Miranda Joy Fields Stephani, , , , , 
Miranda Mary Homburg Biven, , , , , 
Mireille Giang Thu Nguyen, , , , , 
Mireya Anne Rosa Llaurado, , , , , 
Miriam Elizabeth Paul Thacker, , , , , 
Miriam F. Hauser Penney, , , , , 
Miriam Ruth Mandac Arichea, , , , , 
Mirna Janet Sayegh ElHazin, , , , , 
Mirwais Mohammad Asef, , Mirwais, Mohammad, Asef, 
Mitchell Sheldon Terrance Wine, , , , , 
Mohamed Abdullah Omar Hashim, , , , , 
Mohamed Alim Ahmad Malik, , , , , 
Mohamed Amr Ibrahim Razzak, , , , , 
Mohan Ponmalai V Ananda, , Mohan, Ponmalai V, Ananda, 
Mohsen El Attar Ahmed, , , , , 
Mohsen Y. K. Mikhael Elraheb, , , , , 
Moira Isabel Eileen Duvernay, , , , , 
Mollee Sue Oxman Zoken, , , , , 
Mollie Bren Hailey Simons, , , , , 
Molly Alexandra Gerratt Kennedy, , , , , 
Molly Alissa Taylor Zapala, , , , , 
Molly Anne Landon Friend, , , , , 
Molly Anne Stadum Garhart, , , , , 
Molly Berentd Widener Thompson, , , , , 
Molly Louise Hale Chinnock, , , , , 
Molly Renee Appel Morse, , , , , 
Mong Thu Thi Pham, , , , , 
Monica Anne Fascher Johnson, , , , , 
Monica B Berman Borochoff, , , , , 
Monica Cindy Jean Bartolini, , , , , 
Monica L. Wolf Marvin, , , , , 
Monica Lea Wood Haydt, , , , , 
Monica Marie Kirschner Miner, , , , , 
Monica Nilaja Brown Andrews, , , , , 
Monica Sue Hans Folsom, , , , , 
Monika Birgit Gruter Morhenn, , , , , 
Monika Rubena Sanchez Reyes, , , , , 
Monika Satya Kalra Varma, , , , , 
Monique Laureen Yvette Matosian-Bharucha, , , , , 
Monique Lenora Chamlian Wright, , , , , 
Monique Q Tram Keleman, , , , , 
Monique Van Yzerlooy Alonso, , , , , 
Monique Yvonne Cheng Joe, , , , , 
Morgan Arielle Galland Rettig, , , , , 
Morgan Ashley Maltzman Shekhter, , , , , 
Morgan Brittany Anne Thomas, , , , , 
Morgan Donald Seymour Prickett, , , , , 
Morgan John Clift Scudi, , , , , 
Morna L Bowman Rouse, , , , , 
Morton Lee Wayne Friedman, , , , , 
Mukya Sue Denise Porter, , , , , 
Muriel Iris Sylvia Hess, , , , , 
Murray Thomas Stakesby Lewis, , , , , 
My Dung Thi Than, , , , , 
My Linh Thi Nguyen, , , , , 
My Phuong Thi Truong, , , , , 
Mychal Arian Ahmad Luther, , , , , 
Mylene De Guzman Evered, , , , , 
Myles Edward Phillippi Blau, , , , , 
Myra Dell Grether Collins, , , , , 
Myrene Andrea Venida Abot, , , , , 
Myrna Lynn McElhany Minna, , , , , 
N Erin Rose Brewer, , , , , 
N Rebecca A Turner, , N, Rebecca A, Turner, 
Nadia El Farra Awad, , , , , 
Nadia Mahmoud Fiasoso Merzi, , , , , 
Nadia Maria Patricia Wetzler, , , , , 
Nadine Dominique Yacapin Adrian, , , , , 
Nadine Heidi Mode Geher, , , , , 
Nadine Shu Rong Tan, , , , , 
Nafiseh Nina Trehzure Hodjat, , , , , 
Nakesha Steffler Dodson Ruegg, , , , , 
Nam Sun Paik Ufkes, , , , , 
Nanci Anne Sessions Stacey, , , , , 
Nancie Louise Combs Celik, , , , , 
Nancy A. Slagle Grace, , , , , 
Nancy Ann Bibbero Cherney, , , , , 
Nancy Ann N. Baker, , Nancy, Ann N., Baker, 
Nancy Anne P Hunter, , Nancy, Anne P, Hunter, 
Nancy Carolyn Ki Field, , , , , 
Nancy Ellen Balick Nager, , , , , 
Nancy Ellen Kessler Platt, , , , , 
Nancy Heui Seon Yum, , , , , 
Nancy Hong Jiao Zhao, , , , , 
Nancy Jeannette Reyes Guarderas, , , , , 
Nancy Joy Wenger Brown, , , , , 
Nancy Katherine Calhoun Vye, , , , , 
Nancy Lee Nolin McGinnis, , , , , 
Nancy Lyn Sandifer Barillaro, , , , , 
Nancy Lynn Alphenaar Cooper, , , , , 
Nancy Lynn Young Tayui, , , , , 
Nancy Marie Gordon Adams, , , , , 
Nancy My Ngoc Nguyen, , , , , 
Nancy Nell Patton Tostevin, , , , , 
Nancy Ruiz Meza, , Nancy, Ruiz, Meza, 
Nancy Soo Yun Paik, , , , , 
Nancy Thanh Phuong Nguyen, , , , , 
Nancy Van Zile Stewart, , , , , 
Nancy Zabala Graham, , Nancy, Zabala, Graham, 
Nandi Laju Witter Byer, , , , , 
Nandor Ferenc Royal Kiss, , , , , 
Nanya Yoshiko Morinaga Thompson, , , , , 
Naomi Carol Dinces Cohen, , , , , 
Naomi Josephine Harlin Goodno, , , , , 
Naomi Ruth Denise Holliday, , , , , 
Napoleon Laurence David Taylor, , , , , 
Narda Lugo Alarcon Pelham, , , , , 
Nari Erica Cheong Ely, , , , , 
Nasiche Anderson Malone, , Nasiche, Anderson, Malone, 
Nasrin Saberi Shakib, , Nasrin, Saberi, Shakib, 
Natalee Raye Takemoto Fisher, , , , , 
Natalia De Campos Aranovich, , , , , 
Natalie Britton Murray Maki, , , , , 
Natalie Claire Simons Kirkish, , , , , 
Natalie Eden Rachel Lahiji, , , , , 
Natalie Leah Forouzan Rad, , , , , 
Natalie Lora Pardo de Zela, , , , , 
Natalie Marie Pitre Lough, , , , , 
Natalie Perrin- Smith Vance, , , , , 
Natasha Anne Landrum Brooks, , , , , 
Natasha Inder Kaur Dhillon, , , , , 
Natasha Jong Eun Song, , , , , 
Natasha Kerstin Sherwood Page, , , , , 
Natasha Marie Stapel Esses, , , , , 
Natasha Rose Ann Francisco, , , , , 
Nathalia Solis Torres, , Nathalia, Solis, Torres, 
Nathalie Anne Gachot Salami, , , , , 
Nathalie Lezama Ferro, , Nathalie, Lezama, Ferro, 
Nathalie Pinar Lisa Koch, , , , , 
Nathan Daniel Gerrit DeVries, , , , , 
Nathan Frederick Jones Smith, , , , , 
Nathan Leonard James Slegers, , , , , 
Nathaniel Aaron Mathew Zwerdling, , , , , 
Nathaniel Dale Ezekiel Sterling, , , , , 
Nathaniel David Asercion Moore, , , , , 
Nathaniel Justin Reed Smith, , , , , 
Nathaniel Le Roi Dunn, , , , , 
Nathaniel Van Buren Williams III, , , , , 
Naurice Gr Cummings Martin, , , , , 
Neala Caro Marie Peck, , , , , 
Neelufar S ` Ghalichi, , Neelufar, S, Ghalichi, 
Neil A Friedman Popovic, , , , , 
Neil Michael Edwin Forester, , , , , 
Neil Nghia Xuan Nguyen, , , , , 
Nelda Ruth Keller Greer, , , , , 
Neli Tena Reznik, , Neli, Tena, Reznik, 
Netania E Melamed Moore, , , , , 
Ngoc Dan Thanh Huynh, , , , , 
Ngoc Dinh Minh Nguyen, , , , , 
Ngoc Ha T. Nguyen, , Ngoc, Ha T., Nguyen, 
Ngoc Thai Hong Ngo, , , , , 
Ngoc Tram T Nguyen, , Ngoc, Tram T, Nguyen, 
Nguyen Dinh Nguyen Luu, , , , , 
Nguyet Minh Thi Tran, , , , , 
Nhu Y Thi Ngo, , , , , 
Nhung Thi Tuyet Nguyen, , , , , 
Nicholas Adolfo Yllana Garcia, , , , , 
Nicholas Bernard Coolon Schultz, , , , , 
Nicholas Charles Dylan Willoughby, , , , , 
Nicholas John Patrick Tonner, , , , , 
Nicholas John Paul Wagner, , , , , 
Nicholas Kellen Theodore Normington, , , , , 
Nicholas Michael Lars Ginger, , , , , 
Nicholas Morton Hambley Reddick, , , , , 
Nicholas O. von der Lancken, , Nicholas, O., Von Der Lancken, 
Nicholas Victor Peter Clainos, , , , , 
Nicholas Yet Wah Lum, , , , , 
Nichole Ann Moniqua Mongeon, , , , , 
Nichole Brant J Cheneweth, , Nichole, Brant J, Cheneweth, 
Nick Louis Miller Elchinoff, , , , , 
Nicki Marie Varyu Carlsen, , , , , 
Nicolas Michael W DiBella, , Nicolas, Michael W, DiBella, 
Nicole Ani Keshishian Modic, , , , , 
Nicole Ann Bolson Baarts, , , , , 
Nicole Anne Fryklund Buell, , , , , 
Nicole Antoinette Rossi Townes, , , , , 
Nicole Barbara Simpson Bradley, , , , , 
Nicole Denine Brown Yuen, , , , , 
Nicole Di Pauli Gould, , , , , 
Nicole Elizabeth Dale Slaton, , , , , 
Nicole Emily Harris Rouse, , , , , 
Nicole Ilyse Golob Minkow, , , , , 
Nicole Kathleen Holmes Maldonado, , , , , 
Nicole Lina Marjorie Sollberger, , , , , 
Nicole Marisa Vodnoy Johna, , , , , 
Nicole Mary Sahagen Schiff, , , , , 
Nicole Nam-Giao Le Geske, , , , , 
Nicole Noelle Bucur Davidson, , , , , 
Nicole Rachell Duval Gleason, , , , , 
Nicole Yin Chuen Lee Altman, , , , , 
Nicolette Benedicta Cassidy Estrada, , , , , 
Nieva Maria Santana Brock, , , , , 
Nigel David John Wilson, , , , , 
Niki Nabavi Nouri, , Niki, Nabavi, Nouri, 
Niki Uyen Phuong Tran, , , , , 
Nikolas Maria Livius Guggenberger, , , , , 
Nilab Rahyar Tolton, , Nilab, Rahyar, Tolton, 
Nilufar Alemozaffar Motlagh, , Nilufar, Alemozaffar, Motlagh, 
Nina Anne McKay Greeley, , , , , 
Nina Sun Young Ju, , , , , 
Nioura Foad Ghazni, , Nioura, Foad, Ghazni, 
Nisha S Parikh Wright, , , , , 
Noah Jacob Fromm Geldberg, , , , , 
Noah Paul Harris Ornstein, , , , , 
Noah Richard R Cox, , Noah, Richard R, Cox, 
Noel Edmundo Pinga Felarca, , , , , 
Noel M Chain Caughman, , , , , 
Noelle Arienne Roux Dunn, , , , , 
Noelle Dela Rosa Goldberg, , , , , 
Noelle Teresa Resare Warburton, , , , , 
Noga Ann Devecseri Spira, , , , , 
Nola Olympia Javier Jose, , , , , 
Norbert Johann Werner Benecke, , , , , 
Norma H. Ballaris Stone, , , , , 
Norma Joi Savitt Mendelson, , , , , 
Norman Francis Triplett Main, , , , , 
Norman Klaus Hans Miede, , , , , 
Norman Lee Scot Fletcher, , , , , 
Norman William Gholson Von Holtzendorff, , , , , 
Nwabueze Chukwuedoz I Ezeife, , Nwabueze, Chukwuedoz I, Ezeife, 
Ole Romer Aagaard Sandberg, , , , , 
Oliver De Castro Tomas, , , , , 
Olivia Diane Austin Fields, , , , , 
Olivia Margaux Sillett Hardinge, , , , , 
Olivia St. Clair Long, , , , , 
Olivia Vanessa Franco Chavez, , , , , 
Oluwafunmilayo Aderonke Mercy Akinmulero, , , , , 
Omar Walid Ben Khalid, , , , , 
Onuoha Collins Nnadi Oji, , , , , 
Ophelia Hope Fifi Zeff, , , , , 
Oscar Anthony Enciso Garcia, , , , , 
Oscar Arturo Ruiz DeChavez, , , , , 
Oscar Prud Matanguiha Leus, , , , , 
Otto Sun Wolf Trabue, , , , , 
P F Georgia Bullitt, , , , , 
P Jake A Taylor, , P, Jake A, Taylor, 
Padideh Seyed Jafari, , Padideh, Seyed, Jafari, 
Paige Anne Wolverton Winikoff, , , , , 
Paige Elizabeth Fowler Kent, , , , , 
Paige Marie Nordberg Curry, , , , , 
Pallas Po Yuk Hui, , , , , 
Palmer Elyse Zukoski Buchholz, , , , , 
Pamchal Deylami Azodi, , Pamchal, Deylami, Azodi, 
Pamela Ann Samantha Jones, , , , , 
Pamela D. Frasch Frasch, , , , , 
Pamela Gretchen Holz Rupright, , , , , 
Pamela Gretchen S Bousquet, , Pamela, Gretchen S, Bousquet, 
Pamela Jane Birnie Sornson, , , , , 
Pamela Jane Gearhart Frohreich, , , , , 
Pamela Lou Pursifull Aldridge, , , , , 
Pamela M Rosenthal Reynolds, , , , , 
Pamela Malisa Wells Reid, , , , , 
Pamela Mei Ling Hom, , , , , 
Pamela Sue Leilani Maher, , , , , 
Pamela Sue White Patterson, , , , , 
Pamela Tammy Aquino Prieto, , , , , 
Pamela Vivian A. Ehrenkranz, , Pamela, Vivian A., Ehrenkranz, 
Pandit Fateh Kaur Sahota, , , , , 
Pari Naz Haghighat Granum, , , , , 
Patric Harry Ray Weddle, , , , , 
Patricia A Jones Lyman, , , , , 
Patricia Ana Maria Cruz, , , , , 
Patricia Ann Doll Diamond, , , , , 
Patricia Ann Lim Miranda, , , , , 
Patricia Ann Marie Staples, , , , , 
Patricia Ann Pollak Weiss, , , , , 
Patricia Anna Kantor Conway, , , , , 
Patricia Elana Ball Alberts, , , , , 
Patricia Elizabeth Marie Tichenor, , , , , 
Patricia Faye Hutton Williams, , , , , 
Patricia Gertrude Foley Vick, , , , , 
Patricia Heidi J. Kettler, , Patricia, Heidi J., Kettler, 
Patricia Irene Bone Miller, , , , , 
Patricia J Donovan Lamm, , , , , 
Patricia Lee Winters Schmalz, , , , , 
Patricia M. Green Roe, , , , , 
Patricia Marie Michelena Parisi, , , , , 
Patricia Montesinos Bescos, , Patricia, Montesinos, Bescos, 
Patricia Ortiz Magdaleno, , Patricia, Ortiz, Magdaleno, 
Patricia Rae Conrad Lenzi, , , , , 
Patricia Santo Domingo Thomas, , , , , 
Patricia Tara Jeanne Galvin, , , , , 
Patricia Yvonne Ying Mathews, , , , , 
Patrick Andrew George Moloney, , , , , 
Patrick Camilo Custodia Fernandez, , , , , 
Patrick Daniel Nagle Perkins, , , , , 
Patrick Fahmy Aziz Khalil, , , , , 
Patrick Francis Serge Milne, , , , , 
Patrick Henry H. McCarthy Jr, , Patrick, Henry H., McCarthy, Jr
Patrick James Smith Waring, , , , , 
Patrick Joeng Woon Soon, , , , , 
Patrick John Joseph Carney, , , , , 
Patrick Joseph Gerard Stiennon, , , , , 
Patrick Joseph Sean Nellies, , , , , 
Patrick Joseph Sus Inouye, , , , , 
Patrick Joseph Tuano Balucan, , , , , 
Patrick Kenny Michael McCarthy, , , , , 
Patrick Magnus Shepherd Langskog, , , , , 
Patrick Miller K. Richardson, , Patrick, Miller K., Richardson, 
Patrick Norman John Marlborough, , , , , 
Patrick Ramirez Singh Bupara, , , , , 
Patrick Reid Turney Morrison, , , , , 
Patti Delight Wan Soon Choi, , , , , 
Paul Andrew James Hogarth, , , , , 
Paul Andrew Saul Spiegel, , , , , 
Paul Anthony Michael Bruno, , , , , 
Paul Anthony Petrache Fernandez, , , , , 
Paul Chi Fu Pau, , , , , 
Paul Christopher Adam Steinke, , , , , 
Paul Daniel De Dios Rivera, , , , , 
Paul Donald Dudley Bishop, , , , , 
Paul Elliot Epstein Batlan, , , , , 
Paul Erik Thorup Thomsen, , , , , 
Paul Hyung Goo Kang, , , , , 
Paul Ki Won Shin, , , , , 
Paul Leland Reese Danielson, , , , , 
Paul Louis John Takakjian, , , , , 
Paul Louis Weder Laprairie, , , , , 
Paul Po Ren Cheng, , , , , 
Paul Sang Won Choo, , , , , 
Paul Tze Wun Jhin, , , , , 
Paul William Andrew Severin, , , , , 
Paula Cristina Pacheco deSousa, , , , , 
Paula Marlis Elisabeth Pyers, , , , , 
Pauline Chia Poh Ung, , , , , 
Pauline Holland Galbraith Getz, , , , , 
Pauline Hong Soonsung Suh, , , , , 
Pavlina Kochankovska Rafter, , Pavlina, Kochankovska, Rafter, 
Pearl Jean Louie Piatt, , , , , 
Peder John Vikan Thoreen, , , , , 
Pedro Bernal Bilse, , Pedro, Bernal, Bilse, 
Pedro Enrique Corona De La Fuente, , , , , 
Pegge Yuk Lan Lum, , , , , 
Peggy Vynette Dolores Almquist, , , , , 
Penelope A. Creasey Greenberg, , , , , 
Peter Alden Thomas Sartin, , , , , 
Peter Andrew Vincent Huegel, , , , , 
Peter Anh Minh Tran, , , , , 
Peter David G Sabido, , Peter, David G, Sabido, 
Peter Felix Moritz Warburg, , , , , 
Peter Henry Aaron Wodinsky, , , , , 
Peter Horace Frederick Graber, , , , , 
Peter Hughes Driscoll McKee, , , , , 
Peter In Sub Hwang, , , , , 
Peter Jin Young Choi, , , , , 
Peter John Pershing Nebesar, , , , , 
Peter Joseph Mario Bowers, , , , , 
Peter Josserand XIII, , Peter, Josserand, Xiii, 
Peter Ki Hwan Chun, , , , , 
Peter Kwok Lui Tung, , , , , 
Peter Mu Chiu Choy, , , , , 
Peter Nim Kwok Poon, , , , , 
Peter Otto Tum Suden, , , , , 
Peter Paul Lusardi Broccoletti, , , , , 
Peter Ping Tak Tong, , , , , 
Peter Ross H. Patterson, , Peter, Ross H., Patterson, 
Peter Russell John Thompson, , , , , 
Peter Tri Minh Nguyen, , , , , 
Peter William Szekerak Szendroy, , , , , 
Peter Won Joong Yoon, , , , , 
Peter Yeu Lee Chao, , , , , 
Petra Heidi Andrea Korn, , , , , 
Philalethe Stella M. Martin, , Philalethe, Stella M., Martin, 
Philip Allan Desmond Hurst, , , , , 
Philip Angelo Lim Nulud, , , , , 
Philip David White Miller, , , , , 
Philip Denzil Ward Hodgen, , , , , 
Philip Edward Thomas Tutt, , , , , 
Philip Edwy Milton Crooker, , , , , 
Philip Gregory Scott Born, , , , , 
Philip Hans Rolf Nevinny-Stickel, , , , , 
Philip Hsi Lun Shen, , , , , 
Philip Kyung Soo Shin, , , , , 
Philip Mark Allen Sanguinetti, , , , , 
Philip Micah Lealde Dodgen, , , , , 
Philip Yok Hua Yeung, , , , , 
Philippa Shiona Birch Grumbley, , , , , 
Phillip Allan Trajan Perez, , , , , 
Phillip Edward William Maroc, , , , , 
Phillip Hee Min Kwon, , , , , 
Phillip Lewis James Sandoval, , , , , 
Phillip Richard Atillio Mastagni, , , , , 
Phillip Sheridan O'Neil Coonley, , , , , 
Phillip Teuaki Senituli Tukia, , , , , 
Pho Ethan Dinh Tran, , , , , 
Phuong Nha Tran Nguyen, , , , , 
Phyl Allen Diri VanAmmers, , , , , 
Phyllis A Shafton Katz, , , , , 
Phyllis Ann Gutterman Pollack, , , , , 
Phyllis AnnMarie Pope Fetters, , , , , 
Pia Marie E Dyquiangco, , Pia, Marie E, Dyquiangco, 
Pier Paolo Paul Caputo, , , , , 
Pierre Fredrick Vasserot Merle, , , , , 
Pogey Heather Anne Henderson, , , , , 
Polina Maria Melamed Beckerson, , , , , 
Polly Mei-Ru Wang Link, , , , , 
Priscilla Romero C Gerry, , Priscilla, Romero C, Gerry, 
Priscillia Brigitte Jourdain De Muizon, , , , , 
Queenie Kwan Ling Hui, , , , , 
Quincy James Louis Braxton, , , , , 
Quisteen Si Yin Shum, , , , , 
Quoc an Ngoc Nguyen, , , , , 
Quyen Samantha Chi Nguyen, , , , , 
Quyen Vu Ha Luu, , , , , 
Quynh Anh T. Nguyen, , Quynh, Anh T., Nguyen, 
Quynh Tram Thuy Tran, , , , , 
Qwalyne Makanani Elise Lawson, , , , , 
R J Rodriguez Strotz, , , , , 
R L Kim Collins, , , , , 
R. L. Smith McKeithen, , , , , 
Rachael Ann Buckman Tillman, , , , , 
Rachael Ann Neal Harrington, , , , , 
Rachael Eliana Greene Sokoloff, , , , , 
Rachael Elizabeth Brown Binder, , , , , 
Rachael Lynn Ballard Mccracken, , , , , 
Rachel Anandi Zellner Vida, , , , , 
Rachel Andrea Moser Greene, , , , , 
Rachel Ann Devlahovich Sievert, , , , , 
Rachel Ann Hartje Miller, , , , , 
Rachel Anne Densford Bodley, , , , , 
Rachel Anne Markel Catt, , , , , 
Rachel Dene Serena Hood, , , , , 
Rachel E M Velcoff Hults, , , , , 
Rachel Elizabeth King Lowe, , , , , 
Rachel Elizabeth Kosmal McCart, , , , , 
Rachel Katherine Schmid VanMullem, , , , , 
Rachel Katy Ann Lorber, , , , , 
Rachel Kristen Munk Piersig, , , , , 
Rachel Lauren Spitzer Rikleen, , , , , 
Rachel M. Scatizzi Thompson, , , , , 
Rachel Malia Giubilato Hochstetler, , , , , 
Rachel Marie Schumacher Kapuschansky, , , , , 
Rachel S. Ruttenberg Milman, , , , , 
Rachel Shana Owen Katzman, , , , , 
Rachel Yun Mee Chang, , , , , 
Rachelle Clarissa Sanchez Delucchi, , , , , 
Rachelle Karen Hong Barton, , , , , 
Rachelle Marie Niedzwiecki Weed, , , , , 
Radha Daya Shruthi Kulkarni, , , , , 
Raena Elizabeth Walker Ohiri, , , , , 
Rafael Carmona Toscano, , Rafael, Carmona, Toscano, 
Rafael Deaquino Villar, , Rafael, Deaquino, Villar, 
Rahbeka Louise Hall Harris, , , , , 
Rahul Raghav Athrey Hari, , , , , 
Raine McKenna Apuakea Arndt-Couch, , , , , 
Ralph Dennis Frederick Sweeney, , , , , 
Ralph L. "Chip" Putnam, , , , , 
Ralph L. Stiffler Krog, , , , , 
Ram Das Singh Khalsa, , , , , 
Ramiro Flores Munoz, , Ramiro, Flores, Munoz, 
Ramsey Frank Mustafa Hanafi, , , , , 
Randa Abdel Fattah Osman, , , , , 
Randall Winston Bew Albright, , , , , 
Randee June Gorin Fenner, , , , , 
Randolph Weckerle M Linehan, , Randolph, Weckerle M, Linehan, 
Raoul Peter Andvada Bermejo, , , , , 
Raphaela Amity Jane Taylor, , , , , 
Raquel Ashley Leah Jakobovich, , , , , 
Rattan Dev Singh Dhaliwal, , , , , 
Raul Villarreal Garza, , Raul, Villarreal, Garza, 
Raven Marie Ward Sarnoff, , , , , 
Ray Antonio Nava Santana, , , , , 
Raymond Edward Awa Kong Jr, , , , , 
Raymond Harry Martin Danow, , , , , 
Raymond Jae Hak Seo, , , , , 
Raymond Mario Reyes Rollan, , , , , 
Raymond Nicholas S Erlach, , Raymond, Nicholas S, Erlach, 
Raymond Vincent Michael Dunn, , , , , 
Rea Mae E. Gacad, , Rea, Mae E., Gacad, 
Reagan Lacee Burrow Smith, , , , , 
Reagan Lee Brenneman Desmond, , , , , 
Rebecca A Manson Medici, , , , , 
Rebecca A Wheeler Walston, , , , , 
Rebecca Bo Ming Der, , , , , 
Rebecca Elaine Tavares Chapman, , , , , 
Rebecca Erin Tondow Smith, , , , , 
Rebecca Grace Lewallen Kagin, , , , , 
Rebecca Higgins Hilborne Dorshorst, , , , , 
Rebecca Jeanne Anderson Reyes, , , , , 
Rebecca Joyce Harris Jones, , , , , 
Rebecca Judith Rachel Marsden, , , , , 
Rebecca Kathleen Sullivan Silbert, , , , , 
Rebecca Lee Tomlin Schroff, , , , , 
Rebecca Linn Tsou Fong, , , , , 
Rebecca Louise Spain Keller, , , , , 
Rebecca Lynn Bell Butler, , , , , 
Rebecca Marie Kramer Bitzer, , , , , 
Rebecca Myung Hui Choi, , , , , 
Rebecca O Bresnick Holmes, , , , , 
Rebecca Reece Wardell Monroe, , , , , 
Rebecca Rose Anderson Smith, , , , , 
Rebecca Shireen Matthews Becker, , , , , 
Rebekah Kirby Anela Tychsen, , , , , 
Rebekah Lucinda Jackson Sapirstein, , , , , 
Rebekah Nicole Heiser Hanley, , , , , 
Rebekah Susanne Strawn Guyon, , , , , 
Rebekka Michelle Adams Higgs, , , , , 
Reed Talbot Callister Glyer, , , , , 
Regina Kuang Rong Liou, , , , , 
Regina Madrid Pesqueira, , Regina, Madrid, Pesqueira, 
Regina Sonja Lea Adams, , , , , 
Regina Thuy-Quyen T Tran, , Regina, Thuy-Quyen T, Tran, 
Reginald Eli Phillip Roy, , , , , 
Reginaldo Javier Gonzales Villarreal Jr, , , , , 
Reinel Padilla Sanchez, , Reinel, Padilla, Sanchez, 
Reinier Huw John Hughe Lock, , , , , 
Rena Chaya Brickman Rosen, , , , , 
Renee Cheryl Snyder Feldman, , , , , 
Renee Dubie van Beever, , Renee, Dubie, Van Beever, 
Renee Lee-Ann Pratt Spieckermann, , , , , 
Renee Mew Hung Yuen, , , , , 
Renee Nichole Galente Stackhouse, , , , , 
Reno Frank Relle Fernandez III, , , , , 
Resa Reiko Kinikia Berry, , , , , 
Revital Shavit Barsheshet, , Revital, Shavit, Barsheshet, 
Rhea Lynn Murphy Ricard, , , , , 
Rheem Shahla Aziz Araj, , , , , 
Rhoda Ann Ayres Yarbrough, , , , , 
Rhonda Varette Magee Andrews, , , , , 
Ria M. VanDaalen Wetters, , , , , 
Ria Mae F. Pascual, , Ria, Mae F., Pascual, 
Rianne Elizabeth Nolan Rocca, , , , , 
Rica Monina Cruz Santo, , , , , 
Ricardo Arias Gutierrez, , Ricardo, Arias, Gutierrez, 
Riccardo Maddalosso S G, , Riccardo, Maddalosso S, G, 
Richard Adam McDowell Hornung, , , , , 
Richard Alan Berman Groman, , , , , 
Richard Allan Dwight Nelson, , , , , 
Richard Andrew Vachon Vachon SJ, , , , , 
Richard Anh Chuong LeVu, , , , , 
Richard Bland Lee Fleming, , , , , 
Richard Brendan John Bull, , , , , 
Richard Charles J. Kitto Jr, , Richard, Charles J., Kitto, Jr
Richard Coveney E. Anderson, , Richard, Coveney E., Anderson, 
Richard David Millman Stokes, , , , , 
Richard Dean Alfred Tipton, , , , , 
Richard E. Michael Brakefield, , , , , 
Richard Edgar Lewis Strauss, , , , , 
Richard Eric Anthony Dwyer, , , , , 
Richard Ernest Walter Knox, , , , , 
Richard Eugene Vassau Harris, , , , , 
Richard F Cavanaugh Hayden, , , , , 
Richard Gary Artemis Ewell, , , , , 
Richard George Andrew Bone, , , , , 
Richard George Rene Schickele, , , , , 
Richard Gregory Noble Weston, , , , , 
Richard Hoyt Steven Weber, , , , , 
Richard Jean Francis Ortoli, , , , , 
Richard John Lee Nelson, , , , , 
Richard Kwang Pei Ting, , , , , 
Richard Lewis Alan Weiner, , , , , 
Richard Lionel Bob Vincent, , , , , 
Richard Louis Patrick Conner, , , , , 
Richard Mone Joseph Cleary, , , , , 
Richard Needham W Lambert, , Richard, Needham W, Lambert, 
Richard Pierre Bartel Tyson, , , , , 
Richard Riozza E. Ramos, , Richard, Riozza E., Ramos, 
Richard Seth Ellis Johns, , , , , 
Richard Shiu Jung Hung, , , , , 
Richard Stiles Law Roddis, , , , , 
Richard Wang Kun Suh, , , , , 
Richard Ward Wright Klink, , , , , 
Richard William A'Court Horton, , , , , 
Richard Ye Myo Tun, , , , , 
Richie Khanh Phi Nguyen, , , , , 
