full_name, prefix, fname, mname, lname, suffix
A C Richard Parsons, , , , , 
A. P. Michael Narlian, , , , , 
Aaron Alfred A Aquino, , Aaron, Alfred A, Aquino, 
Aaron Charles Goben Carpenter, , , , , 
Aaron David Acevedo Gest, , , , , 
Aaron Gibran Haq Lawrence, , , , , 
Aaron La Vell Swickard, , , , , 
Aaron R Anderson Bolgatz, , , , , 
Aaron Thomas Higa Corey, , , , , 
Aaron Tuen Fai Chiu, , , , , 
Aase Christina Tynes Moncrief, , , , , 
Abby Lynn Turnoff Feinman, , , , , 
Abdul Malik Dantala Freeman, , , , , 
Abe Abundio Delicona Marapao, , , , , 
Abigail Conzatti Nichols Slonecker, , , , , 
Abigail Jean Ryan McLaughlin, , , , , 
Abigail Joy Stecker Romero, , , , , 
Abigail Sullivan Engen, , Abigail, Sullivan, Engen, 
Abimael J. Bastida De Jesus, , , , , 
Abraham Jacob Joseph Brandwein, , , , , 
Adam Ali Dominic Freeman, , , , , 
Adam Charles Ernest Wright, , , , , 
Adam Daniel Alexander Nourafchan, , , , , 
Adam Douglas Howard Grant, , , , , 
Adam James Christophe Gill, , , , , 
Adam James Eugene Weidner, , , , , 
Adam Pierre Michael Noah, , , , , 
Adam Walter Gould Freed, , , , , 
Adanna Stella C. Ukah, , Adanna, Stella C., Ukah, 
Adham Ran Ibrahim Nasser, , , , , 
Adia Malik Linton Goss, , , , , 
Adilene Flores Estrada, , Adilene, Flores, Estrada, 
Adolphe Riviere Edward Roome, , , , , 
Adrian Chong Lim Yeo, , , , , 
Adrian Jo C. Guidotti, , Adrian, Jo C., Guidotti, 
Adrian Victor Alexander Strelzow, , , , , 
Adriana Arpino Abreu Pilemalm, , , , , 
Adrianne J Brownstein Simon, , , , , 
Adrienne Amaris Chun Ancheta, , , , , 
Adrienne Nancy Jacobs Miller, , , , , 
Adrienne Sybil Leight Rogers, , , , , 
Adrienne Therese Proverb Hale, , , , , 
Agnes Chung Yun Lui, , , , , 
Ahva Nakisa Afnani Aflatooni, , , , , 
Ai Nhan Mina Tran, , , , , 
Aida Shafa Akhavan, , Aida, Shafa, Akhavan, 
Aimee Yun Zhen Hui, , , , , 
Alai Kimberly Nyokabi Toure, , , , , 
Alaina Kathryn Roche Kwasizur, , , , , 
Alan Alfred John Leggett, , , , , 
Alan Hong Gu Kang, , , , , 
Alan Ronald H. Newman, , Alan, Ronald H., Newman, 
Alanna Anh Huynh Hua, , , , , 
Alanna Gayle Buchanan Carbis, , , , , 
Alanna Nicole Lynn Dion, , , , , 
Alanna S. Perez Romo, , , , , 
Alaric Winston F Weltner, , Alaric, Winston F, Weltner, 
Alarise Thea A. Guevara, , Alarise, Thea A., Guevara, 
Alastair John MacKinnon Findeis, , , , , 
Albert Asmus Herman Koch, , , , , 
Albert Morris Tremaine Finch III, , , , , 
Albert Peter Dewit Stiefvater, , , , , 
Albert Pui Fu Siu, , , , , 
Albert Yao Whei Huang, , , , , 
Aldo Perry Orlie Branch, , , , , 
Aldys Arabelle Dayle London, , , , , 
Alec Arthur James Wheatley, , , , , 
Aleem Ullah Khan Raja, , , , , 
Alejandro Angel Luis PoncedeLeon, , , , , 
Alekzandir James Lloyd Morton, , , , , 
Alex Cheng Kang Fang, , , , , 
Alex Ching Chuan Chang, , , , , 
Alex See Foong Yap, , , , , 
Alex Van Phu Nguyen, , , , , 
Alexa Sofia Zanolli Austin, , , , , 
Alexander Bain Tyre Cobb, , , , , 
Alexander Burgess M. Aronson, , Alexander, Burgess M., Aronson, 
Alexander Carl Leif Olsson, , , , , 
Alexander Christian Miles Kotschubei, , , , , 
Alexander Curr Northcutt Zocchi, , , , , 
Alexander David Prego Bartel, , , , , 
Alexander David Wesley Promm, , , , , 
Alexander Dewitt Singh Kullar, , , , , 
Alexander George Dahlin Carl, , , , , 
Alexander Jacob Leal Kaplan, , , , , 
Alexander Kwong Chi Wang, , , , , 
Alexander Michael Philip Perry, , , , , 
Alexander Philip George Cuffe, , , , , 
Alexander Yuan Sheung Adams, , , , , 
Alexandra Anne Harman Murphy, , , , , 
Alexandra de Fatima Lopez, , , , , 
Alexandra Demetra Page Tolbert, , , , , 
Alexandra Heather Magill Bromer, , , , , 
Alexandra Julia Sloan Kelly, , , , , 
Alexandra Jung Min Kwak, , , , , 
Alexandra Lee Brandon Bernardo, , , , , 
Alexandra Lee Eilers Koloskus, , , , , 
Alexandra Marie Julie Zindel, , , , , 
Alexandra Marie Stenstedt Leeper, , , , , 
Alexandra Medina Montgomery, , Alexandra, Medina, Montgomery, 
Alexandra Nga Tran Manbeck, , , , , 
Alexandria Ione- Raphaele Brandon, , , , , 
Alexis Adian Houle Smith, , , , , 
Alexis Anne Wilber Moody, , , , , 
Alexis Danielle Rothschild James, , , , , 
Alexis Ivar Nicholas Haller, , , , , 
Alexis Nicole Fung Chen Pen, , , , , 
Alexis R Adler Schrader, , , , , 
Alexis Renee De Armendi Backs, , , , , 
Alexis Sai Yuen Pong, , , , , 
Alexis Siu Ming Chiu, , , , , 
Alexis Smith Aguilar, , Alexis, Smith, Aguilar, 
Alfonso Maldonado Silva, , Alfonso, Maldonado, Silva, 
Alfred Chueh Chin Yen, , , , , 
Alfred Joseph Toulon Byrne, , , , , 
Alfred Kwok Kit Leong, , , , , 
Alfred Von Kessler IV, , Alfred, , Von Kessler, IV
Alfredo Blair Dumas Silva, , , , , 
Ali Agha Hosseini, , Ali, Agha, Hosseini, 
Ali Emadi Konjin, , Ali, Emadi, Konjin, 
Ali Heidari Saeid, , Ali, Heidari, Saeid, 
Ali Mojibi Yazdi, , Ali, Mojibi, Yazdi, 
Alice J Um Kope, , , , , 
Alice Jeanne Benoite Duclos, , , , , 
Alice Kwong Ma Hayashi, , , , , 
Alice Lih-Ling Chen Smith, , , , , 
Alice Suet Yee Barkley, , , , , 
Alicia Anne Garrido Limtiaco, , , , , 
Alicia del Carmen Minana, , , , , 
Alicia Marie Todd Kantor, , , , , 
Alina Birute Marija Mazeika, , , , , 
Alisa Mlyn Ivers Leventis, , , , , 
Alisha Mei Yuk Louie, , , , , 
Alison Anderson Williams Andre, , , , , 
Alison Ann Fischer Silvers, , , , , 
Alison Archer Wright Foster, , , , , 
Alison Dodd Fusco Weinstein, , , , , 
Alison Elizabeth Hajdusiewicz McLaughlin, , , , , 
Alison Fiona Clarke Lima, , , , , 
Alison Gansert Kertis, , Alison, Gansert, Kertis, 
Alison Jayne Walker Chandler, , , , , 
Alison Jean Wright MacDonald, , , , , 
Alison Joyce S Powell, , Alison, Joyce S, Powell, 
Alison Louise Janutolo Maxwell, , , , , 
Alison Robin Mashin DeGuere, , , , , 
Alison Sara Minet Adams, , , , , 
Alison Sue Melnick Hightower, , , , , 
Alissa Ann Trabajo Lim, , , , , 
Alissa Pualani Tamiyo Kubochi, , , , , 
Alissa Rose Malzman Sterling, , , , , 
Alistair David James Shaw, , , , , 
Allan Kirk Arkley Marson, , , , , 
Allegra Alyson Merril Lamorte, , , , , 
Allegra Elisabeth Marta Geller-Kudrow, , , , , 
Allison Decelles Hebl Soares, , , , , 
Allison Elizabeth Ray Nyssens, , , , , 
Allison Galena Bothell Schnieders, , , , , 
Allison Karen Meshekow Holtzman, , , , , 
Allison Myheera Leopold Tilley, , , , , 
Allison Okiyo Watkins Mallick, , , , , 
Allison Renee Emerson Jones, , , , , 
Allison Seu Yun Chang, , , , , 
Allison Wills Post Harris, , , , , 
Allyson Erwin De Guzman Bautista, , , , , 
Alma Luz Custodio Cruz, , , , , 
Aloma Hyang Sue Avery, , , , , 
Alphan King Chu Tsoi, , , , , 
Alvin Cheuk Fung Hui, , , , , 
Alvin David Ellsworth Balahadia, , , , , 
Alyson Maureen McNamara Cunny, , , , , 
Alyson Sumiye Hall Domoto, , , , , 
Alyssa Ann Mervyn Radoumis, , , , , 
Alyssa Laureen Frazier Buffaloe, , , , , 
Alyssa Lynn Lorenz Thompson, , , , , 
Alyssa Ruiz De Esparza, , Alyssa, Ruiz, De Esparza, 
Amadus John Richard Paulsen, , , , , 
Amal Ali Fawzy Abu-Rahma, , , , , 
Amalie Margaret Cleary Weber, , , , , 
Amanda Alexis MacQueen Mattson, , , , , 
Amanda Christine Heiner Carruth, , , , , 
Amanda Claire Brady Ziffra, , , , , 
Amanda De Alba Zamorano, , , , , 
Amanda Emma Sarah Spagnoletti, , , , , 
Amanda Jane Schlatter Gonsalves, , , , , 
Amanda Jean Howard Martin, , , , , 
Amanda Jean Marchand Jones, , , , , 
Amanda Joan Parkison Hassid, , , , , 
Amanda Justine Cargill Scarcella, , , , , 
Amanda Kate Denker Pushinsky, , , , , 
Amanda Katherine Sadie Hill, , , , , 
Amanda Leigh Covey Lloyd, , , , , 
Amanda Lois Rushforth Fates, , , , , 
Amanda Lu Lisbeth Weber, , , , , 
Amanda Marie Loveland Drukker, , , , , 
Amanda Marie Weber LoCurto, , , , , 
Amanda Michelle Rome Dickey, , , , , 
Amanda Paige Severin Wade, , , , , 
Amanda Ruth Coleman Busch, , , , , 
Amaya Gaston Martinez, , Amaya, Gaston, Martinez, 
Amber Eileen Dean Wyatt, , , , , 
Amber Grace Kennedy Madole, , , , , 
Amberlie Francine Romney Zektser, , , , , 
Ambra Dawn Fawcett Dorsey, , , , , 
Amia La Nette Trigg, , , , , 
Amie Lynn Thompson Jacoby, , , , , 
Amina Simone McKoy Levy, , , , , 
Amira Biko Day Dallafior, , , , , 
Amira Sarah Trattner Hasenbush, , , , , 
Amrit Pash Kaur Dhillon, , , , , 
Amy (Amor) Anderson Howse, , , , , 
Amy Ai Dac Chau, , , , , 
Amy Ariel Betts Winger, , , , , 
Amy Catherine Hallman Rice, , , , , 
Amy Celeste Christian McCormick, , , , , 
Amy Chere Christensen Chun, , , , , 
Amy Chin Hsi Yip-Kikugawa, , , , , 
Amy E Shugart Garvin, , , , , 
Amy Elizabeth Lief Baum, , , , , 
Amy Elizabeth Paye Venuto, , , , , 
Amy Elizabeth Spence Smolen, , , , , 
Amy H Choe Silva, , , , , 
Amy Ileene Terrible Myers, , , , , 
Amy Jeanne Rifenbergh Lundberg, , , , , 
Amy Jo Catherine Brown, , , , , 
Amy K. White Fixler, , , , , 
Amy Kathleen Kroll Tinetti, , , , , 
Amy Kim Feith Cramer, , , , , 
Amy Lorraine Barrows Carbins, , , , , 
Amy Louise Nelson Dyble, , , , , 
Amy Lynn Bennecoff Ginsburg, , , , , 
Amy Lynn Fuetterer Greywitt, , , , , 
Amy Malia Mertz Brown, , , , , 
Amy Michele Flint Hinkley, , , , , 
Amy Rebecca Klausman Ransford, , , , , 
Amy Ruth Burton Webber, , , , , 
Amy Wei Mei Ching, , , , , 
Amy Yiu Tze Chai, , , , , 
Ana Clara Da Rosa Alves Vogler, , , , , 
Ana Claudia Casanova Guedes, , , , , 
Ana Cristina Azevedo Toledo, , , , , 
Ana del Carmen Vasquez, , , , , 
Ana Karina Vicente De Castro, , , , , 
Ana Luiza Rosario Sousa, , , , , 
Ana Maria Corazon Bernardo Bondoc, , , , , 
Ana Patrisia Perez Hallmon, , , , , 
Anabela de S R M F Ennes, , , , , 
Analee J Nations Brodie, , , , , 
Analise Nicole Martinez Tilton, , , , , 
Anand Paul Singh Judge, , , , , 
Ananda Joy Miriam Norris, , , , , 
Anastasia Brenhilda E Watson, , Anastasia, Brenhilda E, Watson, 
Anastasia Scannell Christina McMurry, , , , , 
Andre Des Rochers, , Andre, Des, Rochers, 
Andrea Alaine Felix Yu, , , , , 
Andrea Anne Ahern Robinson, , , , , 
Andrea Burgat Dupray Huber, , , , , 
Andrea Elizabeth Julia Blinder, , , , , 
Andrea Fujii Beth Johnson, , , , , 
Andrea I-Chia Chen Ayvazian, , , , , 
Andrea Jessica Sophinda Kahn, , , , , 
Andrea Jill Weiss Jeffries, , , , , 
Andrea Lauren Groves Henry, , , , , 
Andrea M. Fernandez Jackson, , , , , 
Andrea Michelle Wendt Olson, , , , , 
Andrea Sue Wah Maglasang-Miller, , , , , 
Andrea Wipawee Suarez Paris, , , , , 
Andrenna Marie Hidalgo Berggren, , , , , 
Andrew Anthony Joseph Torres, , , , , 
Andrew Armen James Antaramian, , , , , 
Andrew Calvin Eugene Bell, , , , , 
Andrew Daniel Hayden Barron, , , , , 
Andrew David Tolleris Pfeffer, , , , , 
Andrew David Waggaman Cattell, , , , , 
Andrew J. Connick Doran, , , , , 
Andrew James William Bartlett, , , , , 
Andrew John William Holmer, , , , , 
Andrew Marcus Weil Bertolli, , , , , 
Andrew Mark Paul Rudnicki, , , , , 
Andrew Philip Pomfret Dunk III, , , , , 
Andrew Richard Edward Gale, , , , , 
Andrew Ryan Gatchell Gibson, , , , , 
Andrew Seung Chi Yee, , , , , 
Andrew Sing Huo Ting, , , , , 
Andrew Stephen Paul Greenhalgh, , , , , 
Andrew Stephen Priestly Williams, , , , , 
Andrew Ten Broeck Hanker, , , , , 
Andrew Thomas Ketterson Aller, , , , , 
Andrew Timothy James Hurley, , , , , 
Andrew Yin Li Pang, , , , , 
Andrew Yun Cheng Yen, , , , , 
Andy Jhu Heon Jun, , , , , 
Aneiko LaVaun Webb Hickerson, , , , , 
Angel Ka Wing Leung, , , , , 
Angel Love Go Gonzalez, , , , , 
Angela Catherine Claire Viramontes, , , , , 
Angela Faith Proffitt Rediger, , , , , 
Angela Katina Hsieh Dremann, , , , , 
Angela M McNair Turner, , , , , 
Angela Marie S Machala, , Angela, Marie S, Machala, 
Angela Mechelle Ayers Corriero, , , , , 
Angela Mia Alioto Veronese, , , , , 
Angela Nerissa Lytton Ganata, , , , , 
Angela Van Orman Mastroni, , , , , 
Angela Young Sun Suh, , , , , 
Angela Yuen Yuk Ting, , , , , 
Angelica Maria Morales Brody, , , , , 
Angelica Yolanda Castillo Daftary, , , , , 
Angeline Nicole Anastasopoulos Capetanakis, , , , , 
Angelo Maria Zaide Perillo, , , , , 
Angie Siu Yee Mah, , , , , 
Angie Yoon Kyung Rho, , , , , 
Anh Duy Quoc Nguyen, , , , , 
Anita D Stearns Stearns Mayo, , , , , 
Anita L Clinton Adams, , , , , 
Anita Shuk Man Choi, , , , , 
Anita Sio Ngai Chien, , , , , 
Anjuli Kaur Arora Dow, , , , , 
Anjuli Noelle Willis McReynolds, , , , , 
Ann E Gormican Anderson, , , , , 
Ann Elizabeth Aiko Hashisaka, , , , , 
Ann Elizabeth Body Golovko, , , , , 
Ann Elizabeth Zelhart Cook, , , , , 
Ann Hardgrove Voris McGlenon, , , , , 
Ann Kim Berridge Carroll, , , , , 
Ann La Morena Rohlin, , , , , 
Ann Maria Caviani Pease, , , , , 
Ann Marie Christine Villafana, , , , , 
Ann Marie E Ursini, , Ann, Marie E, Ursini, 
Ann Marie Elizabeth James, , , , , 
Ann Marie Heimberger Jernow, , , , , 
Ann Marie Katherine Jelacich, , , , , 
Ann Marie Yolanda DeSimone, , , , , 
Ann Mary Elizabeth Olson, , , , , 
Ann Michi Nishizaka Kahng, , , , , 
Ann Montague Christopher Martin, , , , , 
Ann Nhieu Thi Nguyen, , , , , 
Ann Nichole Y. Agravante, , Ann, Nichole Y., Agravante, 
Ann-Marie Gare Nevolo, , Ann-Marie, Gare, Nevolo, 
Anna Anh Thu Tran, , , , , 
Anna Catherine Newman Dahlquist, , , , , 
Anna Chhiv Lang Tang, , , , , 
Anna Chris Welo Waldrop, , , , , 
Anna Claire Johnson Raba, , , , , 
Anna Elisabeth Wilhelmina Schmitz, , , , , 
Anna Frances Gabriel Teruel, , , , , 
Anna Gabriela Dantas Flowers, , , , , 
Anna Grey Faircloth Feingold, , , , , 
Anna H Sorokin Cronk, , , , , 
Anna Jean Clifton Emard, , , , , 
Anna Jeanne Paule Gassot, , , , , 
Anna Karenina Pedraja Adraneda, , , , , 
Anna Katarina Viktoria Phillips, , , , , 
Anna Livia Levitt Heller, , , , , 
Anna Liza Domingo Guillermo, , , , , 
Anna M Przyblsk Manayan, , , , , 
Anna Marie B Garcia, , Anna, Marie B, Garcia, 
Anna Marie Farrales Tamayo, , , , , 
Anna Marie Mamangun Capillas, , , , , 
Anna Marie Samardich Tyner, , , , , 
Anna Rhea Valle Samson, , , , , 
Anna Rose Madrigal Monguia, , , , , 
Anna Strasburg Katrina Davis, , , , , 
Anna Virginia Robb Macaulay, , , , , 
Annalisa Louise Batanides Tuel, , , , , 
Anne C. Shelby Ramberg, , , , , 
Anne Caitriona Wood Kuykendall, , , , , 
Anne Carol Cruz Elder, , , , , 
Anne Catherine Handley Lynch, , , , , 
Anne Elizabeth Ligman Turner, , , , , 
Anne Elizabeth Taubes Warner, , , , , 
Anne Hillary Lee Lowinger, , , , , 
Anne Lena Kovacovich Bingaman, , , , , 
Anne Liezel Albano Asis, , , , , 
Anne Louise Hamilton Blanchard, , , , , 
Anne Lydia Maurer Collins, , , , , 
Anne M Lawlor Goyette, , , , , 
Anne Margaret Maletis Cepeda, , , , , 
Anne Marie Alcantara Liu, , , , , 
Anne Marie Dowden Saxton, , , , , 
Anne Marie E Bishop, , Anne, Marie E, Bishop, 
Anne Marie Hart Walton, , , , , 
Anne Marie Janine DeBartolomeo, , , , , 
Anne Marie Kucera Sablock, , , , , 
Anne Marie Lund Nielsen, , , , , 
Anne Marie San Pedro Bautista, , , , , 
Anne Marie Veronica Duncan, , , , , 
Anne Marie Warren Duffy, , , , , 
Anne Millar Jeffrey Schneider, , , , , 
Anne Therese Imogen Macias, , , , , 
Anne Von Der Lieth Gardner, , , , , 
Anne Yu Jung Chang, , , , , 
Anne-Leith Ferguson W Matlock, , Anne-Leith, Ferguson W, Matlock, 
Anneke Joan Saltzstein Blye, , , , , 
Annette De La Torre Raij, , , , , 
Annie Ai Yin Huang, , , , , 
Annie Grace Caballero Betinol, , , , , 
Annie Kai Wei Kong, , , , , 
Annie Kimo Han Esposito, , , , , 
Annie Kwan Yi Chan Persampieri, , , , , 
Annie Laurie Patricia Abriel, , , , , 
Annie Ruth Dozier Parenzan, , , , , 
Annikka Cordelia Woodward Berridge, , , , , 
Anthony Bang Kai Wang, , , , , 
Anthony Donald M. Peluso, , Anthony, Donald M., Peluso, 
Anthony Donald Moore Doyle, , , , , 
Anthony George Franklin Howe, , , , , 
Anthony George Joseph Joyce, , , , , 
Anthony L. Isamu Perez, , , , , 
Anthony Ling Yee Wan, , , , , 
Anthony Paul John Valenti, , , , , 
Anthony Peirson Xavier Bothwell, , , , , 
Anthony Quang Huy Bui, , , , , 
Anthony Tien Ja Liang, , , , , 
Antigone Zoe Brown Davoulas, , , , , 
Antoine J. Bastien van der Meer, , , , , 
Antoine Keith Francis Smiley, , , , , 
Anton Joseph Will Babich, , , , , 
Anton Roberts E. Richardson, , Anton, Roberts E., Richardson, 
Antonia Alice Badway Miceli, , , , , 
Antonio Augusto Passos Senra, , , , , 
Antonio Del Rosario Quirante, , , , , 
Antonio Je Nuval Moya, , , , , 
Anwar Dillon Thomas Burton, , , , , 
Apemwoyah Kisob Alaric-Lorenzo, , Apemwoyah, Kisob, Alaric-Lorenzo, 
April Kathryne Motell Ford, , , , , 
April Liza Galagar Domingo, , , , , 
Arabelle Lou Arancel Aportadera-Torres, , , , , 
Aram Sean Anvar Durphy, , , , , 
Arash Aminian Baghai, , Arash, Aminian, Baghai, 
Archana Baily Vittal Bhuta, , , , , 
Ardene Lee 12051995 Larsen, , , , , 
Area Julie Maude Parke, , , , , 
Aren Lee Roy Altman, , , , , 
Ari Jacob Khuner Haber, , , , , 
Ariadne J. Elizabeth Symons, , , , , 
Ariadne Maria Eleni Giannis, , , , , 
Ariana Noelle Seldman Hawbecker, , , , , 
Arianne Marie G. Espinueva, , Arianne, Marie G., Espinueva, 
Ariel Leah Ungerleider Kelley, , , , , 
Ariella T Chinwe Onyeama, , , , , 
Arielle Anais Pauline Tokorcheck, , , , , 
Aris Michele Allyn Shatteen, , , , , 
Arjuna Gale Cooper Anderson, , , , , 
Arlan La Monte Harrell, , , , , 
Arlene Grace De Vera Tecson, , , , , 
Arline Hee Sun Yoo, , , , , 
Armando de Jesus Paz, , , , , 
Armstrong, , , , , 
Arnold De Vera Mina, , , , , 
Arthur Aaron Michael Brieno, , , , , 
Arthur Burtis Leach Martin Jr, , , , , 
Arthur Yee Dean Ong, , , , , 
Arturo Fernando Shaw Gutierrez, , , , , 
Arwa Jabir Zakir Kakavand, , , , , 
Asal Nadjarzadeh Shira, , Asal, Nadjarzadeh, Shira, 
Ashlee Marie Bonds Espaillat, , , , , 
Ashlee Michelle Gray Johnson, , , , , 
Ashley Ahmadian Fard, , Ashley, Ahmadian, Fard, 
Ashley Anna Connell Melwani, , , , , 
Ashley Beatrice Rahn Wheelock, , , , , 
Ashley Brooke Vinson Crawford, , , , , 
Ashley Della Inouye Rodriguez, , , , , 
Ashley Elizabeth Colto Hongisto, , , , , 
Ashley Felise Risner Copp, , , , , 
Ashley Jacobson Cheryl Remillard, , , , , 
Ashley Kathleen Julian Jason, , , , , 
Ashley Lillian Erickson Reineman, , , , , 
Ashley Lynn Flor Edwards, , , , , 
Ashley Marie Gulke Leavitt, , , , , 
Ashley Mina Anne Walsh, , , , , 
Ashley Nicole Lee Dowd, , , , , 
Ashley Nicole Ruth Amar, , , , , 
Ashley Simone Anderson Jackson, , , , , 
Athena Sook Gyung Hwang, , , , , 
Athina Karamanlis Powers, , Athina, Karamanlis, Powers, 
Atoosa Zeinali Gelabi, , Atoosa, Zeinali, Gelabi, 
Aubrey Willie Arthur Weldon, , , , , 
Audrey Jennifer Jing Faber, , , , , 
Audrey Marie Marguerit Cubizolles, , , , , 
Audrey Sheila Bronson Ezratty, , , , , 
August Adison Peters Beam, , , , , 
Augustine M. Castro Ginigeme, , , , , 
Auliya Kiyomi Yasuda Stevens, , , , , 
Aurelia Mayorga Razo Mattson, , , , , 
Aurelie Marie Christell Huet, , , , , 
Aurelio Gerard Cruz Angeles, , , , , 
Auriol Louise Rose Steel, , , , , 
Aurora Leigh Perez Basa, , , , , 
Aurora Ler Fajardo Timbol, , , , , 
Aurore Augustine Gisele Boussemard, , , , , 
Avital Sara Joche Eitan, , , , , 
Avril Dionne Gros Love, , , , , 
Aycan Iskent Ekener, , Aycan, Iskent, Ekener, 
Ayda Babaei Beigi, , Ayda, Babaei, Beigi, 
Azad Preet Singh Virk, , , , , 
Azar Yasaman Najafi Sedghani, , , , , 
B Kay Bender Jones, , , , , 
B Paul Antony Morison, , , , , 
B. D. Marx Greene, , , , , 
B. Elizabeth Borad Goode, , , , , 
Baharam Denise Vatani Heinz, , , , , 
Bali Kris Kollin Kumar, , , , , 
Bao Hien Natalie Vu, , , , , 
Bao Ngoc Xuan Nguyen, , , , , 
Barbara Abigail E Stevens, , Barbara, Abigail E, Stevens, 
Barbara Alcalde Leal Leonard, , , , , 
Barbara An Ellen Caulfield, , , , , 
Barbara Ann Koslowski Mendenhall, , , , , 
Barbara Ann Monica Skotte, , , , , 
Barbara Bryant Hunting Bean, , , , , 
Barbara Carol Smit Jacobs, , , , , 
Barbara Carole M Kogen, , Barbara, Carole M, Kogen, 
Barbara Chuen Ying Laam, , , , , 
Barbara Emily Cowin Figari, , , , , 
Barbara Faye Enloe Hadsell, , , , , 
Barbara J Ruediger Catlow, , , , , 
Barbara Jane S Ferrall, , Barbara, Jane S, Ferrall, 
Barbara Jean Ross Jones, , , , , 
Barbara Jo Miller Wertheimer, , , , , 
Barbara Law Fagan James, , , , , 
Barbara Lorraine Louie Cardinal, , , , , 
Barbara Michele Church Thomas, , , , , 
Barbara Monique Ann Hannah, , , , , 
Barbara Ruth Rostholder Saltzman, , , , , 
Barbara St. Sauver Corley, , , , , 
Barbara W. Gilfillan Crowley, , , , , 
Barrett Ramsey Pierce Schaefer, , , , , 
Barrington Arthur S Daltrey, , Barrington, Arthur S, Daltrey, 
Barry Daniel Alan Bryan, , , , , 
Barton William Sterling Bassett, , , , , 
Beatrice Ann Mercader Pangilinan, , , , , 
Beatrice L. Williams Kemp, , , , , 
Beatrice R. Payton Lawson, , , , , 
Beatriz Maria Garcia Gordon, , , , , 
Behrouz Shareghi Arani, , Behrouz, Shareghi, Arani, 
Beko Osiris Ra Reblitz-Richardson, , , , , 
Belma Demirovic Chinchoy, , Belma, Demirovic, Chinchoy, 
Ben F Pierce Gore, , , , , 
Ben John Gilera Atienza, , , , , 
Benedict James Joffe Adelson, , , , , 
Benedicte Ellen Francoise Mathijsen Bayi, , , , , 
Benjamin Arthur Joseph Bertran-Harris, , , , , 
Benjamin Benchley Lain Austin, , , , , 
Benjamin Christopher Charles Walsh, , , , , 
Benjamin de la Torre Vasquez, , , , , 
Benjamin Franklin S Card II, , Benjamin, Franklin S, Card, II
Benjamin Harry Beryll Sley, , , , , 
Benjamin Isaac Leventhal Hicks, , , , , 
Benjamin Jeremy O'Donnell Setel, , , , , 
Benjamin Neil Stuart Clarke, , , , , 
Benjamin Tien Ren Fox, , , , , 
Benjamin W Grant Barnes, , , , , 
Benson Kwok Wai Lau, , , , , 
Berkeley Suzanne Lee Collins, , , , , 
Bernard Tsz Wai Pang, , , , , 
Bernardo Tamez Alarcon, , Bernardo, Tamez, Alarcon, 
Bernice Ling Louie Yew, , , , , 
Bertha Cortes Carey, , Bertha, Cortes, Carey, 
Bertram Charles Hirst Simon, , , , , 
Beth Alicia Fri Kirk, , , , , 
Beth Ann Dorothy Lane, , , , , 
Beth Hooton Ruiz, , Beth, Hooton, Ruiz, 
Beth J Pearce Pickering, , , , , 
Beth Lauren Appelbaum Mitchell, , , , , 
Beth Lee Urich Williams, , , , , 
Bethann Kathryn Bolte Londynsky, , , , , 
Bethany Marie Kaye Burnett, , , , , 
Bethany Sara Katz French, , , , , 
Betina Alicia S Baumgarten, , Betina, Alicia S, Baumgarten, 
Betty Ann Helen DegnGlass, , , , , 
Betty Anne Cherry Kaufman, , , , , 
Betty J Bales Knisely Foster, , , , , 
Betty Jean Oestreich Shea, , , , , 
Betty Jo Morrison Sheldon, , , , , 
Betty Lai Mee Homer, , , , , 
Betty Lena Egeberg Jeppesen, , , , , 
Betty Rubin Elbaz, , Betty, Rubin, Elbaz, 
Betty S N Auton Beck, , , , , 
Beverly P.M. D. Dempsey, , Beverly, P.M. D., Dempsey, 
Beverly R Boli Altschuler, , , , , 
Bevin Elaine Allen Pike, , , , , 
Bianca Vega Garcia Snead, , , , , 
Bianne Nawaf Rashid Sadeddin, , , , , 
Bill Claude N. Asakawa, , Bill, Claude N., Asakawa, 
Billie Ann Uilani Higa, , , , , 
Binh Duong T Pham, , Binh, Duong T, Pham, 
Birgitta Desiree C. Poole, , Birgitta, Desiree C., Poole, 
Birte Hoehne Mahyera, , Birte, Hoehne, Mahyera, 
Bjorn Christer Speas Roos, , , , , 
Blair Alexandra Sophia Markovic, , , , , 
Blake Clayton Anderson Lawless, , , , , 
Blake Randell Jacob Cox, , , , , 
Bob Bo Yang Zhao, , , , , 
Bobbie Charles Chas. Lobdell, , , , , 
Bobbie Nazaneen Sheiban Eftekar, , , , , 
Bobby Chung-Chyn Lih, , Bobby, Chung-Chyn, Lih, 
Bobette Jane Stern Jones, , , , , 
Bonnie Frances C. Dailey, , Bonnie, Frances C., Dailey, 
Bonnie Gail Stern Wasser, , , , , 
Bonnie Joy Cooper Zahn, , , , , 
Bonnie Joy Frances Anderson, , , , , 
Bonnie Sin Yee Tang, , , , , 
Bonnie T. Carrasco Ramirez, , , , , 
Boris Ragnar Zeus Lieberman, , , , , 
Bradford Lindsay Williams Bowen, , , , , 
Bradley Allan Jackson McGavin, , , , , 
Bradley Dane Loren Burton, , , , , 
Brady Van Houtan Deal, , , , , 
Braedon Chuck Hin Dung, , , , , 
Brandi Gayle Stelter Wallace, , , , , 
Brandi Lynn Galvin Morandi, , , , , 
Brandie Marie Ribeiro Huggett, , , , , 
Brandii Akimee Genease Rice, , , , , 
Brandon Darel Brooks Howard, , , , , 
Brandon Joseph Clarke Payette, , , , , 
Brandon Michael Emerson Schantz, , , , , 
Brandon Michael Jacob Gantus, , , , , 
Brandon Tyler Khalil Kahoush, , , , , 
Breann Yoshiko Swann Nu'uhiwa, , , , , 
Breanne Allyn Leigh Grey, , , , , 
Breanne Elizabeth Christine Salmond, , , , , 
Brenda Anne Stevens Sherry, , , , , 
Brenda Ayon Verduzco, , Brenda, Ayon, Verduzco, 
Brenda Depew Jocz, , Brenda, Depew, Jocz, 
Brenda Diane Essy Yanoschik, , , , , 
Brenda Jean Eng Hom, , , , , 
Brenda Louise Godfrey Geiger, , , , , 
Brenda Marie Shellerud Rivecca, , , , , 
Brenda Nicole Kosma Radmacher, , , , , 
Brendan Oliver Tre Sanchez, , , , , 
Brendon Laurs Steffan Hansen, , , , , 
Brent Cabot James Britton, , , , , 
Brent Sterling Barrett Lindgren, , , , , 
Brett Albin Frederick Miller, , , , , 
Brett Ashley Edwards Smith, , , , , 
Brett Herman William Wanner, , , , , 
Brett Karl Eskildsen Lund, , , , , 
Briahna Julia Marie Chuvac, , , , , 
Brian Alan Dan Angelini, , , , , 
Brian Allen Christopher Ford, , , , , 
Brian Erwin Velarde Llanos, , , , , 
Brian Gabriel Mendoza Huey, , , , , 
Brian Gerard Gonzalez Armstrong, , , , , 
Brian Hyun Min Kang, , , , , 
Brian John Thomas Purtill, , , , , 
Brian Jose Miguel Quinn, , , , , 
Brian Kee Oh Hong, , , , , 
Brian Kwock Chieu Kau, , , , , 
Brian Lee Soon Mackinnon, , , , , 
Brian Matthews Ostau Kopperl, , , , , 
Brian Michael James Hussey, , , , , 
Brian Robert Satter Shaw, , , , , 
Brian Samuel Clayton Conlon, , , , , 
Brian Victor William Pogue, , , , , 
Brian Yun Kong Ching, , , , , 
Brianna Leigh Busch Abrams, , , , , 
Brianna Margaret Mix Sweeney, , , , , 
Brianne Eileen Fine Richmond, , , , , 
Bridget Anne Blazek Kovacs, , , , , 
Bridget Ilene Keto Harrison, , , , , 
Brien Thomas Joseph Collins, , , , , 
Brier Katherine Miron Setlur, , , , , 
Brigid Cay Dade Campo, , , , , 
Brigid Slaine Anne McNally, , , , , 
Brinda Bellur Laxminarayan, , Brinda, Bellur, Laxminarayan, 
Brittany Dawn Ashley Gardiner Rogers, , , , , 
Brittany Lauren Malak Safar, , , , , 
Brittany Le An Vannoy, , , , , 
Brittany Lei Son Little, , , , , 
Brittany Lisa Clark Knotts, , , , , 
Brittany Marie Sturgis Vojak, , , , , 
Brittany Morgan N. Stonesifer, , Brittany, Morgan N., Stonesifer, 
Brittany Rupley Haefele, , Brittany, Rupley, Haefele, 
Britten Kekaimalie Bailey Westsmith, , , , , 
Brittnee Lauren Davis Gillespie, , , , , 
Brittney Heather Marie Aquino, , , , , 
