Deborah Mary Susan Kornheiser, , , , , 
Deborah Mew Ling Yeung, , , , , 
Deborah Penny Port Bennett, , , , , 
Deborah Rachel Gershon Cesario, , , , , 
Deborah Siew Luan Chew, , , , , 
Deborah So Jin Kwon, , , , , 
Deborah Sue Skanadore Reisdorph, , , , , 
Deborah Sue Turner Feinerman, , , , , 
Debra Ann Amy Akiyama, , , , , 
Debra Ann Ichimura Gass, , , , , 
Debra Dianne Jenkins DeBose, , , , , 
Debra Jade Mundel Marx, , , , , 
Debra Jean Litwiler Collicott, , , , , 
Debra Lynn Muhr Lambert, , , , , 
Debra Marie Anderson Leyva, , , , , 
Debra Marie Canales Montoya, , , , , 
Debra Mary Jo Stephens, , , , , 
Debra Sarah White Palmer, , , , , 
Deidra Davetta Marinda Ritcherson, , , , , 
Deirdre Elizabeth Abele Ramanujam, , , , , 
Deirdre Ellen Taber Kingsbury, , , , , 
Delanie DeWitt Ann Painter, , , , , 
Deleela M. Ivey Weinerman, , , , , 
Delia Mae Sharpe Parr, , , , , 
Delisle Garvin St.Clair Warden, , , , , 
Delmer Bernard Lyle Sokol, , , , , 
Dena Joy Horton Stone, , , , , 
Denise Ada Louise Pereira, , , , , 
Denise Gayle Godfrey Helfstein, , , , , 
Denise Lillian Riley Donovan, , , , , 
Denise Marie McIntosh Stevens, , , , , 
Denise Nguyet Anh Ngo, , , , , 
Denisse Lopez Campa, , Denisse, Lopez, Campa, 
Dennis Bian Hui Poey, , , , , 
Dennis Gorgias Isocrates Hanna, , , , , 
Dennis Mark Parente Ehling, , , , , 
Dennis Patrick Roy Codon, , , , , 
Dennis Robert Bjorn Larson, , , , , 
Dennis Warren Ter Bush, , Dennis, Warren, Ter Bush, 
Denver C Charles Peckinpah, , , , , 
Deok Keun Matthew Ahn, , , , , 
Derek Wai Kam Yeung, , , , , 
Desire Darline Johannah Lance, , , , , 
Desiree Adell Rooney Woods, , , , , 
Desiree Angelique Marie Nicolaou, , , , , 
Desmond George Lloyd Lawrence, , , , , 
Devin Joyce Hom Chin-Lee, , , , , 
Devin William Friend Arp, , , , , 
Devon Lee Reed Lomayesva, , , , , 
Dexter Ceasar Lim Tiu, , , , , 
Dia Sinohuiz Diaz Rogers, , , , , 
Diana Cecilia Guzman Boley, , , , , 
Diana Lea Allen Jackson, , , , , 
Diana Rosales Sanabria, , Diana, Rosales, Sanabria, 
Diana Sutton-Van Cleve, , Diana, Sutton-Van, Cleve, 
Diane Carol Hall Reynolds, , , , , 
Diane Clare Todd Schettini, , , , , 
Diane E. Douglas Tufts, , , , , 
Diane Janine Norma Morin, , , , , 
Diane Margaret Rea Morse, , , , , 
Diane Marie Pierno Leonard, , , , , 
Diane Marie Von Der Ahe, , Diane, Marie, Von Der Ahe, 
Diane May Lew Tan, , , , , 
Diane Sue Messer Dodds, , , , , 
Dianne Celestine Baquet Smith, , , , , 
Dick Anne Martinus Schouten, , , , , 
Didier Laurent Gade Diels, , , , , 
Diedre Jane Josephine Bush, , , , , 
Diego Ramirez Rodriguez, , Diego, Ramirez, Rodriguez, 
Diem Thinh Thi Pham, , , , , 
Diem Tuyet Thi Tran, , , , , 
Dieu Dao Ngoc Huynh, , , , , 
Dina Issam Farhat Amani, , , , , 
Dina Jayne Sakita White, , , , , 
Diva Mohamad Aziz, , Diva, Mohamad, Aziz, 
Doaa Abdel Rahman Fathallah, , , , , 
Doan Trang Thi Nguyen, , , , , 
Dolly Eloris Ralston Anderson, , , , , 
Dolly Louise Clara Millhone, , , , , 
Dominic Kwek Leung Yoong, , , , , 
Dominique Madalaine Waters Tomaino, , , , , 
Don Le Quy Cung, , , , , 
Don Luis Aniseto Camacho, , , , , 
Don Marc Agor Dimaranan, , , , , 
Don Neil Caceres Pua, , , , , 
Don Zhe Nan Wang, , , , , 
Donald Edward Joseph Kilmer Jr, , , , , 
Donald Floyd Coats Jr., , Donald, Floyd, Coats, Jr.
Donald Gary Jason Davis, , , , , 
Donald Lawrence Block Baraf, , , , , 
Donald Leonard Adams Kerson, , , , , 
Donald Thomas Mark Pieracci, , , , , 
Donald William F. McDonald, , Donald, William F., McDonald, 
Dong Yul Thomas Suh, , , , , 
Donna J Mangio Johnston, , , , , 
Donna Jeanne M. Zenor, , Donna, Jeanne M., Zenor, 
Donna L. Schmitt Calame, , , , , 
Donna Lillian Mithrush Bateman, , , , , 
Donna Lyn Pahl Crosby, , , , , 
Donna Lynn W. Bernstein, , Donna, Lynn W., Bernstein, 
Donna Marie Gunnell Garza, , , , , 
Donna Sue Levit Weissman, , , , , 
Doreen Anna Kay Allen, , , , , 
Dori Akemi Kanani Kojima, , , , , 
Dorian West Blair, , Dorian, West, Blair, 
Dorilyn Kam Lan Ahana, , , , , 
Doris Brigitte Hale Slater, , , , , 
Doris Jean Kendrick Cabrera, , , , , 
Dorothea Ann Hubsch Contreras, , , , , 
Dorothea Marian Lee Tiong, , , , , 
Dorothy Cecilia H. Stetzer, , Dorothy, Cecilia H., Stetzer, 
Dorothy Chan See Yee Kline, , , , , 
Dorothy Diehl Rees Shelton, , , , , 
Dorothy Irene Bacskai Egel, , , , , 
Dorothy Lachmi Hassaram Hoei, , , , , 
Dorothy Lee Calhoun Bonner, , , , , 
Douglas Bo Dine Warren, , , , , 
Douglas Brian Keola Moylan, , , , , 
Douglas Jung Woo Shin, , , , , 
Douglas P Luna Vining, , , , , 
Drew Harry Sidney Jackson, , , , , 
Duane Daniel Byron Nash, , , , , 
Duane Robert Aubrey Lyons, , , , , 
Duane Shelton John Lindsey, , , , , 
Duane Wai Hong Pang, , , , , 
Dugan William Edward Bliss, , , , , 
Duncan Adrian Girard Footman, , , , , 
Dung Thi Hanh Nguyen, , , , , 
Dusty D VanTatenhove Newberg, , , , , 
Duyen Ky Cao Nguyen, , , , , 
Dyanne Christina Lawlor Peters, , , , , 
Dylan E Mcleod Williams, , , , , 
E James H Jeffries, , E, James H, Jeffries, 
E Margarita D Barron, , E, Margarita D, Barron, 
E P Michael Karcis, , , , , 
E S Pete Scherr, , , , , 
Earl James Taylor Oakley, , , , , 
Earl Tut Wun Ing, , , , , 
Earle Richard Leo Soukup, , , , , 
Eben White Hill Whittlesey, , , , , 
Eca Amy C Yu, , Eca, Amy C, Yu, 
Ed Allan Pabalan Lindain, , , , , 
Eda Su Ling Tan, , , , , 
Edgar Dennis Ampig Padernal, , , , , 
Edgar Joseph Spencer Kemp, , , , , 
Edirissa Mohammad Omar Faal, , , , , 
Edith Aurora Rory Hughes, , , , , 
Edith Celine Marie Kinney, , , , , 
Edith Frances Kelly Politis, , , , , 
Edith Lee Anne Clark, , , , , 
Edmond James Buddy Miller Jr, , , , , 
Edmund Allman Burke Mitchell, , , , , 
Edmund Van Braam Roberts, , , , , 
Edna Tsz Chin Fok, , , , , 
Edoardo Rigoberto Caldevilla Salvatore, , , , , 
Edris Wilder Izar Rodriguez Ritchie, , , , , 
Edson Kim Loy Kong, , , , , 
Eduardo Goldberg Shteremberg, , Eduardo, Goldberg, Shteremberg, 
Edward Adolphe G Frisius, , Edward, Adolphe G, Frisius, 
Edward Alexander Liggins Liggins Sr, , , , , 
Edward Chun Yu Yip, , , , , 
Edward David Dayton Magallanes, , , , , 
Edward Jae Ho Chung, , , , , 
Edward Jeffrey Adamos Pineda, , , , , 
Edward Kwok Hee Dong, , , , , 
Edward Liston Owen Allen, , , , , 
Edward Maxwell Alexander Thiele, , , , , 
Edward Otho Cresap Ord, , , , , 
Edward Ted B Paulsen, , Edward, Ted B, Paulsen, 
Edward Thomas Eliot Correro, , , , , 
Edward Thomas Ii Moen, , , , , 
Edward Tsu How Yen, , , , , 
Edward Yee Hong Leung, , , , , 
Edwarda Joan Trimble McGahey, , , , , 
Edwin Clifford Paul Komen, , , , , 
Edwin Tut Chon Ing, , , , , 
Edwina Marie Garner Graham, , , , , 
Efeolu Eniola Yetunde Johnson, , , , , 
Efrain Staino Flores, , Efrain, Staino, Flores, 
Eileen L Leiko Young, , , , , 
Eileen Tanimoto Garmarnik, , Eileen, Tanimoto, Garmarnik, 
Eitan J Reuben Frysh, , , , , 
Elaine C Wisnosky Paschke, , , , , 
Elaine Carol Ruth Giesbrecht, , , , , 
Elaine Florence Bernice Leadlove-Plant, , , , , 
Elaine Linnell Sheppe Bracken, , , , , 
Elaine M. Kiefer Johnson, , , , , 
Elaine Mary Rheda Quinn, , , , , 
Elaine Van Tuong Nguyen, , , , , 
Elaine Yi Ming Cheung, , , , , 
Elana Janelle Stein Moeder, , , , , 
Eleanor A Putman Dunn, , , , , 
Eleanor Mary Wade Youngsmith, , , , , 
Eleanor Morris Miller Roman, , , , , 
Elena Estelle Camaras Abramson, , , , , 
Elena Leslie Haskins DuCharme, , , , , 
Elena Marie Alexander Bowers, , , , , 
Eli Satra Shans, , Eli, Satra, Shans, 
Eliot Wing Chung Kwok, , , , , 
Elisa M D'Angelo Weichel, , , , , 
Elisabeth Michael Wagner Trefonas, , , , , 
Elise Sheryl Fagelson Baker, , , , , 
Elise So Lin Brown, , , , , 
Eliseo Donald Wayne Gauna, , , , , 
Eliza Jane Sophia Manoff, , , , , 
Eliza Page Brink Dermody, , , , , 
Eliza Saint Lum Szeto, , , , , 
Elizabeth A Barbu Sullivan, , , , , 
Elizabeth Amanda Shill Heiner, , , , , 
Elizabeth Andrea Look Margolis, , , , , 
Elizabeth Ann Aakhus McGinnis, , , , , 
Elizabeth Ann Boettger Cannon, , , , , 
Elizabeth Ann Schwind Ikemire, , , , , 
Elizabeth Ann Warke Brem, , , , , 
Elizabeth Ann Wentworth Strickland, , , , , 
Elizabeth Anne Klein Hiller, , , , , 
Elizabeth Anne Richardson LaVier, , , , , 
Elizabeth Anne Sheets Twomey, , , , , 
Elizabeth Anne Virginia Lyons, , , , , 
Elizabeth Avery Lambert Palmer, , , , , 
Elizabeth Berman Lovell, , Elizabeth, Berman, Lovell, 
Elizabeth Catherine Throne Papay, , , , , 
Elizabeth Chau Buu Nguyen, , , , , 
Elizabeth Clare Moreno McArthur, , , , , 
Elizabeth Colleen Tryon Ersun, , , , , 
Elizabeth de Lone Paranhos, , , , , 
Elizabeth De Vee Dorman, , , , , 
Elizabeth Gaye Jeans Thomas, , , , , 
Elizabeth Iona Rogers Brannen, , , , , 
Elizabeth Johanna Katheri Siebel Lorenz, , , , , 
Elizabeth Johnson Johnson Kohn, , , , , 
Elizabeth Jordan Rantz Cobey, , , , , 
Elizabeth Joy Ferrall Bassett, , , , , 
Elizabeth Karin L Brodersen, , Elizabeth, Karin L, Brodersen, 
Elizabeth M Abramson Terrill, , , , , 
Elizabeth M. Barnson Karnazes, , , , , 
Elizabeth M. R-H Parker-Fawley, , , , , 
Elizabeth Mara Adams Labrin, , , , , 
Elizabeth Marie Nixon Morris, , , , , 
Elizabeth Mary Ann Bennion, , , , , 
Elizabeth Mary M. C. Rainsford, , Elizabeth, Mary M. C., Rainsford, 
Elizabeth Michele Demarest Horton, , , , , 
Elizabeth Michelle Beecher Vissers, , , , , 
Elizabeth Michelle Jane McCann, , , , , 
Elizabeth Michelle Mundee Barket, , , , , 
Elizabeth Nguyen Phung Behnke, , , , , 
Elizabeth Njeri Munyi Njuguna, , , , , 
Elizabeth Ridley Gosse Widup, , , , , 
Elizabeth Rose French Monnet, , , , , 
Elizabeth Rose Heffernan Leitzinger, , , , , 
Elizabeth Rose Koller Whittenbury, , , , , 
Elizabeth S. Hunter Milovidov, , , , , 
Elizabeth Satomi Allen Cossi, , , , , 
Elizabeth T McLoughlin Sanders, , , , , 
Elizabeth Wendy S Mandel, , Elizabeth, Wendy S, Mandel, 
Ella Katherine McCrone Hallwass, , , , , 
Ellen Anne Gusikoff Stewart, , , , , 
Ellen E. Sroog Rodin, , , , , 
Ellen Grace Fabio Hsu, , , , , 
Ellen Grace Lauck Strzalkowski, , , , , 
Ellen Hing-Fun Ho Sam, , , , , 
Ellen Jeanne Weis Aragon, , , , , 
Ellen Louise H. Brown, , Ellen, Louise H., Brown, 
Ellen Marie Morris Perkins, , , , , 
Ellen Ruth Paleias Adler, , , , , 
Ellen Shiaofehn Luu Moy, , , , , 
Ellen Yi Yeung Hung, , , , , 
Elliott Edward Harry Alhadeff, , , , , 
Elliott William Hunter Samuels, , , , , 
Elliotte Catherine Zekany McGraw, , , , , 
Elmer Baldwin Ferris Collier, , , , , 
Elvin Minh Huy Vu, , , , , 
Ely Rose A Exner, , Ely, Rose A, Exner, 
Elyce Kae Dronen Santerre, , , , , 
Elyze Josephine McDonald Iriarte, , , , , 
Emanuel Ben Levi Townsend, , , , , 
Ember Lee Chung Shinn, , , , , 
Emi Anne Murphy Donis, , , , , 
Emiko Grace Sakai Burchill, , , , , 
Emil Alfred Joseph Zuccaro, , , , , 
Emilia Petersen Estrella Morris, , , , , 
Emilie Anne Smith Petirs, , , , , 
Emilie Rebecca Anne Rees, , , , , 
Emilio Gonzalez La'O, , Emilio, Gonzalez, La'O, 
Emily Audrey Mary Marshall Pepper, , , , , 
Emily Casey Warren Kapur, , , , , 
Emily Christina Grisafi Kirohn, , , , , 
Emily Dean Wallace Sweet, , , , , 
Emily Eugenia Kordyban Rockwell, , , , , 
Emily Fern Goodenow Nekimken, , , , , 
Emily Jane Mouton Creel, , , , , 
Emily Jeannine McCarthy Bullis, , , , , 
Emily Jill Lynch Morissette, , , , , 
Emily Joy Nickles Erickson, , , , , 
Emily Joyce Buckold Andelman, , , , , 
Emily Lew Inouye Butler, , , , , 
Emily Roberta Schmidt Kam, , , , , 
Emily Rose Dimento Murphy, , , , , 
Emily Rose Maia Nahan-Krotki, , , , , 
Emily Rose Naomi Johns, , , , , 
Emily Ruth Snyder Lough, , , , , 
Emily Su-Lan Reber Porter, , , , , 
Emily Suet Kan Dorsett, , , , , 
Emily Susan Berrio Barbour, , , , , 
Emily Susan Watts Blenner, , , , , 
Emily Van Waning Galvin, , , , , 
Emma Elizabeth Caterina Jacobson, , , , , 
Emma Jane A. Fabeck, , Emma, Jane A., Fabeck, 
Emma Lucille Burns Souza, , , , , 
Emma Maria Friaz Gallardo, , , , , 
Emory Denise Tate Christian, , , , , 
Enrique De Jesus Duarte, , , , , 
Erendira Elizabeth Anne Rubin, , , , , 
Eric Albert Stephan Richards, , , , , 
Eric Andrew G. Matyas, , Eric, Andrew G., Matyas, 
Eric Gustav Nicholas Biber, , , , , 
Eric Gustav Samuel Marcks, , , , , 
Eric Jeffrey Ong Hing, , , , , 
Eric John Fred Mewes, , , , , 
Eric John Thor Nogueira Erickson, , , , , 
Eric Joseph V Gravel, , Eric, Joseph V, Gravel, 
Eric Kai Chun Liang, , , , , 
Eric Kwan Hun Chinn, , , , , 
Eric Peter Kenny Lentell, , , , , 
Eric Scott Cielaszyk West, , , , , 
Eric Stefan Clay Lindstrom, , , , , 
Eric Tet Shin Chung, , , , , 
Eric Vashek Tadashi Nakano, , , , , 
Eric von Geldern, , Eric, , Von Geldern, 
Eric Wei Hoong Ow, , , , , 
Eric Yan Hang Chung, , , , , 
Erica Alwine Graber Iyer, , , , , 
Erica Carol Tierney Atwell, , , , , 
Erica Lee Markum Dennings, , , , , 
Erica M Estes Genthner, , , , , 
Erica Nicole Shelby Murphy, , , , , 
Erick Phillip Michael Walter, , , , , 
Ericka Frances Houck Englert, , , , , 
Erik Kristian James Siddons, , , , , 
Erik Ronald Joseph Laurinovics, , , , , 
Erik St John Lupescu, , , , , 
Erik Walter Rudolph Luckau, , , , , 
Erika Beth Lindberg Beernink, , , , , 
Erika Elizabeth Hier Lennon, , , , , 
Erika Kirsten Leighton Doherty, , , , , 
Erika Lyn Domarew Vargas, , , , , 
Erika Marie Araujo Dominguez, , , , , 
Erika Ramona Cannu Sembrano, , , , , 
Erin Dawn O'Leary Mahoney, , , , , 
Erin Elizabeth Ann Boylan, , , , , 
Erin Elizabeth Burg Hupp, , , , , 
Erin Emily Pritchard Liem, , , , , 
Erin Janel Riley Khorram, , , , , 
Erin Jean Dennis Vivion, , , , , 
Erin Kathleen Lauffer Mahaney, , , , , 
Erin L Spiotta Egan, , , , , 
Erin La Rue Richey, , , , , 
Erin Lea Malloy Chiari, , , , , 
Erin Lee Jeanette Pfaff, , , , , 
Erin Marie Boyd Leach, , , , , 
Erin Marie Mallon Davis, , , , , 
Erin Marie Mooney Pulaski, , , , , 
Erin Marie Souza Santana, , , , , 
Erin Michelle Bogle Kugler, , , , , 
Erin Michelle Harris Friedman, , , , , 
Erin Michelle- Schaap Carlson, , , , , 
Erin Oi Lan-Akemi Buell, , , , , 
Erin R Hegedus McIntosh, , , , , 
Erin Renee Zweigart Dixon, , , , , 
Erin Sabrina Sullivan Guzman, , , , , 
Erinn Renee Wegner PutziLoveland, , , , , 
Erling Clark Haagensen Arend, , , , , 
Ernest Albert Eugene Gellhorn, , , , , 
Ernest Harvey C Boroughs, , Ernest, Harvey C, Boroughs, 
Ernie Kuo Wei Loo, , , , , 
Errol Harlan Brunson Norman, , , , , 
Errol Wilfred Javier Zshornack, , , , , 
Esmeralda De Guzman Yu, , , , , 
Espartaco Diaz Hidalgo, , Espartaco, Diaz, Hidalgo, 
Esperanza Arrizon Palomera, , Esperanza, Arrizon, Palomera, 
Esperanza Dominguez Sanchez McConn, , , , , 
Esteban Morales Fabila, , Esteban, Morales, Fabila, 
Estevan Carlos Chavira Villarreal, , , , , 
Esther Hee Sun Lim, , , , , 
Esther Joan Cid Nazario, , , , , 
Esther Mi Yeon Kang, , , , , 
Esther Signe Marie Olsen, , , , , 
Ethan Allen Hunt Miller, , , , , 
Ethan Edward Schulz Lavelle, , , , , 
Ethan Peter Keith Greene, , , , , 
Ethan Sean Pierce Robinson, , , , , 
Eugene Yue Ching Ngai, , , , , 
Eula Mae Saxon Dean, , , , , 
Eulogio Leon Guerrero Waki, , , , , 
Eunice Shin Hee Kang, , , , , 
Eunice Yu Li Chay, , , , , 
Eunice Yuen Sze Lau, , , , , 
Eva Lyn Mary Casey, , , , , 
Eva Marie Mannoia Weiler, , , , , 
Eva May Denise Schissler, , , , , 
Eva Mei Wah Kwong, , , , , 
Eva Miriam Beegle Cerreta, , , , , 
Eva Vera Morrow, , Eva, Vera, Morrow, 
Evaleon Jeanne Marilyn Hill, , , , , 
Evangelia Floutsis Yvonne Riley, , , , , 
Evangelina Patricia Fierro Hernandez, , , , , 
Evangeline Albright Zimmerman Burbidge, , , , , 
Eve Bernette Rothman Schein, , , , , 
Eve Helayne Lewin Wagner, , , , , 
Eveline Johanna Desiree Mutsaers, , , , , 
Evelyn St John Monahan, , , , , 
Evet S. Loewen Abt, , , , , 
Evon S P Culliton Atkinson, , , , , 
Ex Kano Shirden Sams II, , , , , 
F W Howard Taylor, , , , , 
F. C. Lowell Head, , , , , 
Fady Maher Fahmy Eskandar, , , , , 
Fanny Dusastre Martinez, , Fanny, Dusastre, Martinez, 
Fanny Wai-Yee Wong Tagawa, , , , , 
Farah Naz A. Namvar, , Farah, Naz A., Namvar, 
Farbod Faizai Khorasani, , Farbod, Faizai, Khorasani, 
Farida Dohadwala Yusufali, , Farida, Dohadwala, Yusufali, 
Farouk Ghassan Sami Mansour, , , , , 
Farrah Faranak Noorbakhsh Reynolds, , , , , 
Faustino Isidro Parillas Abad, , , , , 
Felice E. Grossman Greenbaum, , , , , 
Felice Rochelle M Melworm, , Felice, Rochelle M, Melworm, 
Felipe Antonio Albano Chavez, , , , , 
Felix Jonathan E Antero, , Felix, Jonathan E, Antero, 
Fern Ann Nicole Grether, , , , , 
Fern Lynne Zelonky Wender, , , , , 
Fernanda Farias Felicio Bueno, , , , , 
Ferry Eden Bagona Lopez, , , , , 
Fiona Anne McCrae Connell, , , , , 
Fiona Jean Montgomery Miller, , , , , 
Fiona Thuy Duong Lecong-Ly, , , , , 
Flerida Ruth Ceguerra Zabala, , , , , 
Flor de Maria Levandoski, , , , , 
Flor De Maria Tataje, , , , , 
Flora Campos Lara Pereira, , , , , 
Florence Rissa Helen Popper, , , , , 
Florian Alexander Hubertus Carl, , , , , 
Floyd Robert Burks Viau, , , , , 
Frances Irene King Aoun, , , , , 
Frances L. Borden Smith, , , , , 
Frances T. Alexandra Mahaney, , , , , 
Francine Joy Sangor Lane, , , , , 
Francine R Adkins Tone, , , , , 
Francis Cosmo Joseph Pizzulli, , , , , 
Francis Edwin Xavier Murphy, , , , , 
Francis Hugh O'M Chang, , , , , 
Francis Jose Maria Felix, , , , , 
Francis V. Keesling Keesling Sr, , , , , 
Francis Xavier John Hardiman, , , , , 
Francisca Johanna Maria Brouwer, , , , , 
Francisco Manuel Alejandro Delgado, , , , , 
Francois Bernard Taid Auroux, , , , , 
Frank Louis A. Graham, , Frank, Louis A., Graham, 
Frank Masao Ito Taylor, , , , , 
Frank Nick Hugo Malanca, , , , , 
Frank Sang Kook Shyn, , , , , 
Franki Wing Choi Choi Cheung, , , , , 
Franklin Keith Payne Moore, , , , , 
Fred Anthony Michael Bauer, , , , , 
Frederic "Rick" W. Norris, , , , , 
Frederic Lee Francis Hamilton, , , , , 
Frederick Anthony Heep Larson, , , , , 
Frederick Ho Joon Choi, , , , , 
Frederick Wei Xin Lien, , , , , 
Frederick William T. Hoogland, , Frederick, William T., Hoogland, 
Fredericka Lynne Moore McGee, , , , , 
Frederika Rita Elena Ranucci, , , , , 
Friederike Ilse Henriette Padilla, , , , , 
Froilan Ynigo Briones Zuno, , , , , 
G Karl Mathew Greissinger, , , , , 
G. Frances Danielle Harewood, , , , , 
G. W. Skip Simpson III, , , , , 
Gabriel Guerra Medellin, , Gabriel, Guerra, Medellin, 
Gabriel Michael Cortez Mendoza, , , , , 
Gabriel Samuel Jacob Poll, , , , , 
Gabriela Burghelea Tomescu, , Gabriela, Burghelea, Tomescu, 
Gabriela D Horowitz Shapiro, , , , , 
Gabriela de Souza Ferreira, , , , , 
Gabriela Garcia Amandi, , Gabriela, Garcia, Amandi, 
Gabriela Gonzalez Araiza, , Gabriela, Gonzalez, Araiza, 
Gabriela Guadalupe Victoria Mendez, , , , , 
Gabriela Lopez Garcia, , Gabriela, Lopez, Garcia, 
Gabriela Maria Moncayo Higgins, , , , , 
Gabriela Marie Tunzi Behn, , , , , 
Gabrielle Yvette Harner Brumbach, , , , , 
Gail Isabel Nevius Abbas, , , , , 
Gail Lynne Watson White, , , , , 
Gail Marie Ehrhart Currey, , , , , 
Gail Ruffin-Cruz Jones, , Gail, Ruffin-Cruz, Jones, 
Galahad Richard Abaya PeBenito, , , , , 
Garbis Dickran N Etmekjian, , Garbis, Dickran N, Etmekjian, 
Gardiner Beauregard C Johnson, , Gardiner, Beauregard C, Johnson, 
Garfield Anthony A Cramer, , Garfield, Anthony A, Cramer, 
Garland Jeanne Eddins Greenawalt, , , , , 
Garry John Douglas Hubert, , , , , 
Garry Rollin Peter Gonsalves, , , , , 
Gary Harlan Miles Thelander, , , , , 
Gary Justin Gaetano Ciampaglia, , , , , 
Gary Richard Kent Heppell, , , , , 
Gary Richard N Moore, , Gary, Richard N, Moore, 
Gary Tze Hing Chow, , , , , 
Gary Wayne Forrest Watts, , , , , 
Gary William Edward Sanders, , , , , 
Gavin Patrick Wingate Murphy, , , , , 
Gawain Sydney Edward Smart, , , , , 
Gayel Elizabeth Moskowitz Kaplan, , , , , 
Gemia Layne Taylor Mercer, , , , , 
Gemma De Lemos Mondala, , , , , 
Gene Thomas Kim Whitney, , , , , 
Geneva Elizabeth Branson Thompson, , , , , 
Geneve Fu Mei Lung, , , , , 
Genevieve Eliza Lewis Wyman, , , , , 
Geo. Leach Patrick Sargent, , , , , 
Geoff Conner Newlan, , Geoff, Conner, Newlan, 
Geoffrey Charles Stuart Adams, , , , , 
Geoffrey Chi Ho Huang, , , , , 
Geoffrey James Francis MacMillan Jr., , , , , 
Geoffrey Jonathan L Brown, , Geoffrey, Jonathan L, Brown, 
Geoffrey Teru Arai Staniford, , , , , 
George Alejandro Cunningham Warner, , , , , 
George Alfred Henry Turner, , , , , 
George Anthony John Spadoro Jr, , , , , 
George Bowler Tullidge Sturr, , , , , 
George Earl Charles Seymour, , , , , 
George Edwin Peter Siberell, , , , , 
George Frederick Corlis Love, , , , , 
George Herbert Patrick Bursley, , , , , 
George James Niklas Gustafsson, , , , , 
George Jean Batiste Cote, , , , , 
George Keith Harwinter Schell, , , , , 
George Luis Beltran Gutierrez, , , , , 
George Nei Parducho Valdes, , , , , 
George Raymond Farrow Gross, , , , , 
George Ronald Issaeff Beavin, , , , , 
George Stephen Lyle Dunlop, , , , , 
George Troy Franklin Walker Jr, , , , , 
George William Lawrence Hess, , , , , 
George William Merrill Granger, , , , , 
George Young Tack Oh, , , , , 
Georgia Kaye Wisner Couch, , , , , 
Georgina Rosary A DeSantis, , Georgina, Rosary A, DeSantis, 
Gerald Augustus Wilfred Haight, , , , , 
Gerald Hutchinson B. Kane Jr, , Gerald, Hutchinson B., Kane, Jr
Gerald Hwa Wei Tsai, , , , , 
Gerald Jerry G. Spolter, , Gerald, Jerry G., Spolter, 
Gerald Jong Goo Koh, , , , , 
Gerald Patrick Joyce III III, , Gerald, Patrick, Joyce, III, III
Gerald Sang Beum Ohn, , , , , 
Geraldine Beatrice Marie Tissot Brown, , , , , 
Geraldine Mary Daly Alexis, , , , , 
Geraldine Udia Foster Turner, , , , , 
Gerard Arnold Roland Wiener, , , , , 
Gerard Daryl Gavina Eugenio, , , , , 
Gerardo De Los Ang Camacho, , , , , 
Gerardo Otero Vial, , Gerardo, Otero, Vial, 
Gertrude Ann Husser Austin, , , , , 
Gia Johnny Hoang Nguyen, , , , , 
Gian Carlo Maurice Yanke, , , , , 
Giannina Maria A. DaRoza, , Giannina, Maria A., DaRoza, 
Gilbert Marshall Walker Smith, , , , , 
Gilbert Samuel Coloma Keith-Agaran, , , , , 
Gillian Free Nyree Overland, , , , , 
Gillian Nicole Rattray Carcia, , , , , 
Gillian Sedee Brodie Morshedi, , , , , 
Gina Anne Occhipinti Borasi, , , , , 
Gina L Bozajian Eskigian, , , , , 
Gina Marie Samore Smith, , , , , 
Gina Marie Sy Ong, , , , , 
Ginger Florence Heyman Pigott, , , , , 
Ginny Harjot Kaur Walia, , , , , 
Ginny Thao Van Laettner, , Ginny, Thao, Van Laettner, 
Gino Paolo Almosara Pedraja, , , , , 
Giselle Christina Woo Huron, , , , , 
Gisette Minerva Chamorro Denker, , , , , 
Gisue Mehdizadeh Asl, , Gisue, Mehdizadeh, Asl, 
Glenn Ian Maldonado Ramel, , , , , 
Glenn Russell Christophe Abel, , , , , 
Gloria Jean Ann Husick, , , , , 
Gloria L Sunny Johnson, , , , , 
Glyn Eigil Ek Lewis, , , , , 
Gordon Alexander Tim Wille, , , , , 
Gordon Frederick John Bowley, , , , , 
Gordon Gregg Carter Johnson, , , , , 
Gordon Wayne Samuel Bowley, , , , , 
Grace Ann Cayanan Brown, , , , , 
Grace Chung Hang Tong, , , , , 
Grace Del Rosario Siekbert, , , , , 
Grace Gail Ebreo Cara, , , , , 
Grace Hee Eun Yeo, , , , , 
Grace Makiko Kubota Ybarra, , , , , 
Grace Mimi Tai Sander, , , , , 
Grace Sung Ehn Meng, , , , , 
Graciela H Pardave Valenzuela, , , , , 
Graeme Ernest Maxwell Hancock, , , , , 
Graham Stephen Paul Hollis, , , , , 
Grant Leonard Carey Brooks, , , , , 
Grant Maxwell Wong Kolling, , , , , 
Grayce S. Patricia Zelphin, , , , , 
Greg Paulo Narvaez Palomares, , , , , 
Gregg Hannan Stewart Golden, , , , , 
Gregory (Greg) Charles Sicilian, , , , , 
Gregory Charles M. Garratt, , Gregory, Charles M., Garratt, 
Gregory Fenton Williams Todd, , , , , 
Gregory Herman Dacpano Alumit, , , , , 
Gregory Kwock Cheong Apo, , , , , 
Gregory Paul Granville Wharton, , , , , 
Gregory Sai Wing Tse, , , , , 
Gregory Sean Giles Klatt, , , , , 
Greta Ellen Miller Munsill, , , , , 
Gretchen Ilse Bloch Rozio, , , , , 
Gretta Irene Yu-Le Moy, , , , , 
Grey Rachel Rene Galluzi, , , , , 
Griselda Perez Begines Trujillo, , , , , 
Grisselle Bermudez Rodriguez, , Grisselle, Bermudez, Rodriguez, 
Guia Anna Elizabeth Surla Dixon, , , , , 
Guillermo Adrian Miguel Sohnlein, , , , , 
Guillermo Arevalo Farias, , Guillermo, Arevalo, Farias, 
Guillermo Marquez Tello, , Guillermo, Marquez, Tello, 
Guillermo Suarez M., , Guillermo, Suarez, M., 
Guinevere Erin Thomas Woolstenhulme, , , , , 
Gunes Akman Ozcan, , Gunes, Akman, Ozcan, 
Guru Inder Kaur Khalsa, , , , , 
Guru Terath Singh Khalsa, , , , , 
Guy Frank Michael Candelaria, , , , , 
Guy Gedwin Go Grande, , , , , 
Gwendoline San May Theis, , , , , 
Gwendolyn Kathleen O'Herron Faino, , , , , 
Gyongyi Maria Claire Bardos, , , , , 
H A VanConen Torchiana, , , , , 
H Rey Caguioa Gervacio, , , , , 
H. E. Christian Peeples, , , , , 
H. Frederick Montgomery Seigenfeld, , , , , 
H. L. Roy Short, , , , , 
H. Mae G. Alberto, , H., Mae G., Alberto, 
H. R. Harrison Smith, , , , , 
Hae Yung Jayne Ahn, , , , , 
Hae-Won Min Liao, , Hae-Won, Min, Liao, 
Hai Binh Thi Nguyen, , , , , 
Hailey Phelps Anderson Flemming, , , , , 
Hailly Tara Namaka Korman, , , , , 
Haley Elizabeth Palfreyman Jankowski, , , , , 
Haley L Frasca Shumaker, , , , , 
Haley Loraine Irena Rebel, , , , , 
Haley Michelle Agatep Martinez, , , , , 
Hallie Lyn Tremaine Balkin, , , , , 
Hallie Ryan Goins Spaulding, , , , , 
Hamed Amiri Ghaemmaghami, , Hamed, Amiri, Ghaemmaghami, 
Han Dinh Trang Nguyen, , , , , 
Han To-Hoang Nguyen Tokuyama, , , , , 
Hanna Christina Thea Cox, , , , , 
Hanna Gee Ho Yoon, , , , , 
Hannah Jane Elizabeth Leader, , , , , 
Hannah Love Boyd Schartiger, , , , , 
Hans Christian Niels Ruschke, , , , , 
Hans James E Thomas, , Hans, James E, Thomas, 
Hans Julius Alfred Gebhardt, , , , , 
Hari Kishan Lal Heerekar, , , , , 
Harjinder K Shergill Chima, , , , , 
Harlen Edwin Dan Shasteen, , , , , 
Harlow Harvey Amos Hastings Jr, , , , , 
Harold Ernest Joseph Kahn, , , , , 
Harold Jonathan Patric Phenix, , , , , 
Harold Raymond Trafford Carter, , , , , 
Harold William Stix Leeker, , , , , 
Harris Hai Cong Pham, , , , , 
Harry Hamid R Sadeghi, , Harry, Hamid R, Sadeghi, 
Harry Orn Boyle Farris, , , , , 
Hartley Roy David Appleton, , , , , 
Harvey Benjamin Genotiva Fiji, , , , , 
